"id","site","job_url","job_url_direct","title","company","location","date_posted","job_type","salary_source","interval","min_amount","max_amount","currency","is_remote","job_level","job_function","listing_type","emails","description","company_industry","company_url","company_logo","company_url_direct","company_addresses","company_num_employees","company_revenue","company_description","skills","experience_range","company_rating","company_reviews_count","vacancy_count","work_from_home_type"
"li-4427279515","linkedin","https://www.linkedin.com/jobs/view/4427279515","","Software Engineer","Scoutit","","","fulltime","","","","","",False,"entry level","Engineering and Information Technology","","","We're looking for
 **Software Engineers (India)!**
**Responsibilities**
* Design, develop, test, and maintain enterprise\\-grade software applications and backend services
* Build scalable, secure, and high\\-performance application components using modern programming practices
* Collaborate with cross\\-functional teams to analyze requirements and deliver reliable technical solutions
* Develop and maintain APIs, microservices, and system integrations for enterprise applications
* Troubleshoot, debug, and resolve application issues to ensure system stability and performance
* Participate in code reviews, sprint planning, and Agile development activities
* Optimize application performance, scalability, reliability, and overall system efficiency
* Work with relational and non\\-relational databases for data management and application integration
* Contribute to cloud\\-based development, deployment, and automation initiatives


 (
 **\\*Note:** 
 Scoutit is an independent candidate sourcing partner for this hiring. All applications, candidate screening, and hiring\\-related actions are conducted directly by the respective employer’s authorized recruitment team. Relevant candidates will be contacted via email and asked to fill in additional details as part of the next stage of the application process.)
   

  

 Skills: application,code,software","Technology, Information and Internet","https://in.linkedin.com/company/scoutit-in","https://media.licdn.com/dms/image/v2/D560BAQGbgOvn2002Gw/company-logo_100_100/B56Zl31VPfHQAQ-/0/1758652093991/scoutit_in_logo?e=2147483647&v=beta&t=dCA8DUthfJpCcZnA5TI0DZwlcXQ4SKkeic2EoHjTy5g","","","","","","","","","","",""
"li-4408767577","linkedin","https://www.linkedin.com/jobs/view/4408767577","","Senior Software Engineer - Backend and Data","Roku","Bengaluru, Karnataka, India","","fulltime","","","","","",True,"mid-senior level","Engineering and Information Technology","","EmployeeRelations@Roku.com, WorkforcePrivacy@Roku.com","Teamwork makes the stream work.
 
  
 


**Roku is changing how the world watches TV** 

 Roku is the \\#1 TV streaming platform in the U.S., Canada, and Mexico, and we've set our sights on powering every television in the world. Roku pioneered streaming to the TV. Our mission is to be the TV streaming platform that connects the entire TV ecosystem. We connect consumers to the content they love, enable content publishers to build and monetize large audiences, and provide advertisers unique capabilities to engage consumers.
 



 From your first day at Roku, you'll make a valuable \\- and valued \\- contribution. We're a fast\\-growing public company where no one is a bystander. We offer you the opportunity to delight millions of TV streamers around the world while gaining meaningful experience across a variety of disciplines.
 



  
 


**About the Team** 

 Roku pioneered TV streaming and continues to innovate and lead the industry. Continued success relies on investing in the Roku Content Platform, so we deliver high quality streaming TV experience at a global scale. As part of our Content Platform team you join a small group of highly skilled engineers, that own significant responsibility in crafting, developing and maintaining our large\\-scale backend systems, data pipelines, storage, and processing services. We provide all insights in regard to all content on Roku Devices. 
 


  About the Role
 
 We are looking for a Senior Software Engineer with vast experience in backend development, Data Engineering and Data Analytics to focus on building next level content platform and data intelligence, which empowers Search, Recommendation, and many more critical systems across Roku Platform. This is an excellent role for a senior professional who enjoys a high level of visibility, thrives on having a critical business impact, able to make critical decisions and is excited to work on a core data platform component which is crucial for many streaming components at Roku.
 



  
 


**What You’ll Be Doing** 
* Work closely with product management team, content data platform services, and other internal consumer teams to contribute extensively to our content data platform and underlying architecture.
* Build low\\-latency and optimized streaming and batch data pipelines to enable downstream services.
* Build and support our Micro\\-services based Event\\-Driven Backend Systems \\& Data Platform.
* Design and build data pipelines for batch, near\\-real\\-time, and real\\-time processing.
* Participate in architecture discussions, influence product roadmap, and take ownership and responsibility over new projects.



  
 


**We’re excited if you have** 
* 8\\+ years professional experience as a Software Engineer.
* Proficiency in Java/Scala/Python.
* Deep understanding of backend technologies, architecture patterns, and best practices, including microservices, RESTful APIs, message queues, caching, and databases.
* Strong analytical and problem\\-solving skills, data structures and algorithms, with the ability to translate complex technical requirements into scalable and efficient solutions.
* Experience with Micro\\-service and event\\-driven architectures.
* Experience with Apache Spark and Apache Flink.
* Experience with Big Data Frameworks and Tools: MapReduce, Hive, Presto, HDFS, YARN, Kafka, etc.
* Experience with Apache Airflow or similar workflow orchestration tooling for ETL.
* Experience with cloud platforms: AWS (preferred), GCP, etc.
* Strong communication and presentation skills.
* BS in Computer Science; MS in Computer Science preferred.
* AI literacy and curiosity.You have either tried Gen AI in your previous work or outside of work or are curious about Gen AI and have explored it.


  
 
  
 


**Our Hybrid Work Approach** 

 Roku fosters an inclusive and collaborative environment where teams work in the office Monday through Thursday. Fridays are flexible for remote work except for employees whose roles are required to be in the office five days a week or employees who are in offices with a five day in office policy.
 



  
 


**Benefits** 

 Roku is committed to offering a diverse range of benefits as part of our compensation package to support our employees and their families. Our comprehensive benefits include global access to mental health and financial wellness support and resources. Local benefits include statutory and voluntary benefits which may include healthcare (medical, dental, and vision), life, accident, disability, commuter, and retirement options (401(k)/pension). Employees are supported in taking time off, in accordance with local leave policies and other personal needs to support their evolving work and life needs. It's important to note that not every benefit is available in all locations or for every role. For details specific to your location, please consult with your recruiter.
 



  
 


**Accommodations** 

 Roku welcomes applicants of all backgrounds and provides reasonable accommodations and adjustments in accordance with applicable law. If you require reasonable accommodation at any point in the hiring process, please direct your inquiries to EmployeeRelations@Roku.com.
 



  
 


**The Roku Culture** 

 Roku is a great place for people who want to work in a fast\\-paced environment where everyone is focused on the company's success rather than their own. We try to surround ourselves with people who are great at their jobs, who are easy to work with, and who keep their egos in check. We appreciate a sense of humor. We believe a fewer number of very talented folks can do more for less cost than a larger number of less talented teams. We're independent thinkers with big ideas who act boldly, move fast and accomplish extraordinary things through collaboration and trust. In short, at Roku you'll be part of a company that's changing how the world watches TV.
 



 We have a unique culture that we are proud of. We think of ourselves primarily as problem\\-solvers, which itself is a two\\-part idea. We come up with the solution, but the solution isn't real until it is built and delivered to the customer. That penchant for action gives us a pragmatic approach to innovation, one that has served us well since 2002\\.
 



 To learn more about Roku, our global footprint, and how we've grown, visit https://www.weareroku.com/factsheet.
 



 By providing your information, you acknowledge that you want Roku to contact you about job roles, that you have read Roku's Applicant Privacy Notice, and understand that Roku will use your information as described in that notice. If you do not wish to receive any communications from Roku regarding this role or similar roles in the future, you may unsubscribe at any time by emailing WorkforcePrivacy@Roku.com.","Software Development","https://www.linkedin.com/company/roku","https://media.licdn.com/dms/image/v2/D560BAQGwtnEFj0grWQ/company-logo_100_100/B56ZaxohrVH0AU-/0/1746736913380/roku_logo?e=2147483647&v=beta&t=rlz3iSQYwGeir-xgrxNGxQJ9v_dNYWJiqDBsqHkr7L8","","","","","","","","","","",""
"li-4406456529","linkedin","https://www.linkedin.com/jobs/view/4406456529","","Software Engineer III","Walmart Global Tech India","Bengaluru, Karnataka, India","","fulltime","","","","","",False,"mid-senior level","Engineering and Information Technology","","","About Team:
   

  

 Personalization team at Walmart is dedicated to the mission of knowing our customers better and making it frictionless and faster for them to get what they want while building a trusted partnership with Walmart. We help bring a seamless experience to our customers irrespective of how and where they engage with us – while shopping online or picking groceries at stores. We thrive to provide each customer with a journey tailored to their individual needs, preferences and routines. We operate at the intersection of huge Walmart assortment, millions of customers, thousands of stores and Walmart associates \\- a multi\\-layer multi\\-objective problem space which has a unique impact on Global customer base and powers assisted AI for our associates.
   

  

 The Personalization team consists of big data geeks, application engineers, scientists and product visionaries all working together to design, prototype and build technology\\-driven products and experiences that will change the future landscape of e\\-commerce. We are focused on building an intelligent system that will enable 1:1 personalized customer experience, from finding the product to delivering it to the customer. We are building state\\-of\\-the\\-art probabilistic models and engineering marvels to serve our customer needs by leveraging cutting edge machine learning, deep learning, reinforcement learning, natural language processing, entity\\-relationship extraction and knowledge representation. This will span many markets, business models and form factors; therefore, we are looking for scientists and engineers who will bring not only an abundance of experiences in technologies, but an abundant curiosity to innovate.
   

  

 What will you do:
   

  

 Build data\\-driven platforms and capabilities to power Personalization experiences across site, app, stores, voice commerce.
   

  

 Build systems and workflows to process and manage petabyte scales of features data.
   

  

 Collaborate with member of technical staff to deliver end\\-to\\-end scalable systems for cross\\- functional projects.
   

  

 Work closely with business and product stakeholders to deliver on strategy, vision and roadmap for top initiatives in Personalization and Recommendations.
   

  

 Actively keep pace with new developing technologies in the data space and present technical solutions including architecture, design, implementation details, and customer and business impacting KPIs.
   

  

 Actively contribute to research community through participation at conferences, seminar and workshops.
   

  

 What you will bring:
   

  

 You have experience in building large\\-scale distributed systems that process large volume of data focusing on scalability, latency, and fault\\-tolerance.
   

  

 You have knowledge of complex software design, distributed system design, design patterns, data structures and algorithms.
   

  

 You have experience in building systems that orchestrate and execute complex workflows in big\\-data leveraging Apache Spark, Apache Kafka, and Hadoop stack preferably in Google Cloud Platform.
   

  

 You have experience in evaluating and fine\\-tuning systems for speed, robustness, and cost efficiency.
   

  

 You have experience in designing features and models from structured and unstructured data.
   

  

 You have experience in building datasets, tools, and services supporting big data and analytics operations.
   

  

 You have experience in relational SQL and NoSQL databases like Cassandra, AzureSQL, Cosmos.
   

  

 You are proficient in Java or Scala, Python, shell scripts, HQL, SQL.
   

  

 You have experience with distributed version control like Git or similar.
   

  

 You are familiar with continuous integration/deployment processes and tools such as Jenkins and Maven.
   

  

 You have strong written and oral communication skills.
   

  

**About Walmart Global Tech**
 Imagine working in an environment where one line of code can make life easier for hundreds of millions of people. That’s what we do at Walmart Global Tech. We’re a team of software engineers, data scientists, cybersecurity expert's and service professionals within the world’s leading retailer who make an epic impact and are at the forefront of the next retail disruption. People are why we innovate, and people power our innovations. We are people\\-led and tech\\-empowered.
   

  

 We train our team in the skillsets of the future and bring in experts like you to help us grow. We have roles for those chasing their first opportunity as well as those looking for the opportunity that will define their career. Here, you can kickstart a great career in tech, gain new skills and experience for virtually every industry, or leverage your expertise to innovate at scale, impact millions and reimagine the future of retail. Flexible, hybrid work
   

  

 Walmart’s culture sets us apart, and we know being together helps us innovate, learn and grow great careers. This role is based in our \\[Bangalore/Chennai] office for daily work, with the flexibility for associates to manage their personal lives.
   

  

**Benefits**
 Beyond our great compensation package, you can receive incentive awards for your performance. Other great perks include a host of best\\-in\\-class benefits maternity and parental leave, pto, health benefits, and much more.
   

  

 Belonging
   

  

 We aim to create a culture where every associate feels valued for who they are, rooted in respect for the individual. Our goal is to foster a sense of belonging, to create opportunities for all our associates, customers and suppliers, and to be a Walmart for everyone.
   

  

 At Walmart, our vision is ""everyone included."" by fostering a workplace culture where everyone is—and feels—included, everyone wins. Our associates and customers reflect the makeup of all 19 countries where we operate. By making Walmart a welcoming place where all people feel like they belong, we’re able to engage associates, strengthen our business, improve our ability to serve customers, and support the communities where we operate.
   

  

 Equal opportunity employer
   

  

 Walmart, inc., is an equal opportunities employer – by choice. We believe we are best equipped to help our associates, customers and the communities we serve live better when we really know them. That means understanding, respecting and valuing unique styles, experiences, identities, ideas and opinions – while being inclusive of all people.
   

  

 Minimum Qualifications...Outlined below are the required minimum qualifications for this position. If none are listed, there are no minimum qualifications.
   

  

 Option 1: Bachelor's degree in computer science, computer engineering, computer information systems, software engineering, or related area and 2 years’ experience in software engineering or related area.
   

  

 Option 2: 4 years’ experience in software engineering or related area.
   

  

 Preferred Qualifications...Outlined below are the optional preferred qualifications for this position. If none are listed, there are no preferred qualifications.
   

  

 Master’s degree in Computer Science, Information Technology, Engineering, Information Systems, Cybersecurity, or related area, We value candidates with a background in creating inclusive digital experiences, demonstrating knowledge in implementing Web Content Accessibility Guidelines (WCAG) 2\\.2 AA standards, assistive technologies, and integrating digital accessibility seamlessly. The ideal candidate would have knowledge of accessibility best practices and join us as we continue to create accessible products and services following Walmart’s accessibility standards and guidelines for supporting an inclusive culture.
   

  

 Primary Location...Block\\- 1, Prestige Tech Pacific Park, Sy No. 38/1, Outer Ring Rd Kadubeesanahalli , India","Software Development","https://in.linkedin.com/company/walmartglobaltechindia","https://media.licdn.com/dms/image/v2/C4D0BAQEC3n4yU_w6bQ/company-logo_100_100/company-logo_100_100/0/1630541053165/walmartglobaltechindia_logo?e=2147483647&v=beta&t=KB5uAZVI1HRhFi7_oz2n8i2VD4Sx9DcqRNE-fpD1_zY","","","","","","","","","","",""
"li-4374257366","linkedin","https://www.linkedin.com/jobs/view/4374257366","","Software Development Engineer in Test I","HackerRank","Bengaluru East, Karnataka, India","","fulltime","","","","","",False,"entry level","Engineering and Information Technology","","","HackerRank helps companies like NVIDIA, Amazon, and Microsoft hire and upskill the next generation of developers based on skills, not pedigree. Our platform is trusted by over 2,500 of the world’s most innovative companies to build strong engineering teams ready for what’s next.
   

  

 Software has entered an era where humans and AI build side by side. As this shift accelerates, the definition of strong technical talent is changing. We give companies better ways to identify and invest in next\\-generation skills.
   

  

 People at HackerRank care deeply about the impact of their work and sweat the small details so our customers can be wildly successful with products they genuinely love to use. We move with urgency and believe great outcomes come from high standards.
   

  

**About The Role**
 As a SDET, you will play a critical role in shaping and executing our automation\\-first quality strategy across web, API and AI\\-driven systems.
   

  

 You’ll work closely with Engineering and Product teams to ensure that quality is designed into every feature, enforced through strong automation, and protected by strict release gates. This is a hands\\-on, technically deep role with real ownership and impact.
   

  

**What You’ll Do**
* Design, build, and maintain scalable automation frameworks using Playwright and SerenityJS
* Contribute to the enhancement and scalability of existing automation frameworks
* Build and maintain REST API automation using Postman or equivalent tools
* Integrate and maintain automated test execution within CI/CD pipelines (e.g., Jenkins, GitHub Actions)
* Investigate test failures, perform root cause analysis, and collaborate with engineering teams to resolve issues
* Ensure automated test coverage aligns with defined acceptance criteria and release requirements
* Participate in automation code reviews to maintain consistency, readability, and maintainability
* Support execution of regression, integration, and end\\-to\\-end test suites across environments
* Collaborate during story refinement and design discussions to identify test scenarios, risks, and edge cases
* Contribute to automation reporting, metrics, and continuous quality improvements
* Work closely with cross\\-functional teams to promote quality best practices


**Who You Are**
* 2\\+ years of experience in QA Automation / SDET roles
* Strong hands\\-on experience with modern automation frameworks (Playwright preferred)
* Proficiency in JavaScript/TypeScript for building maintainable test automation
* Solid understanding of REST API testing concepts and tools such as Postman
* Experience integrating and running automated tests within CI/CD pipelines
* Familiarity with BDD practices and frameworks such as Cucumber
* Working knowledge of Git and modern version control workflows
* Experience working in containerized environments (e.g., Docker); exposure to Kubernetes is a plus
* Understanding of regression, integration, system, and end\\-to\\-end testing principles
* Ability to debug automation failures and analyze application issues effectively
* Strong communication skills and ability to collaborate with developers and product teams


**Even better if you have**
* Exposure to accessibility testing and understanding of WCAG principles
* Experience with visual regression or cross\\-browser testing
* Familiarity with cloud\\-native or SaaS\\-based platforms
* Exposure to AI\\-assisted testing tools or testing AI\\-driven features
* Experience contributing to automation dashboards or quality metrics


**You will thrive in this role if**
* Believe quality is a shared responsibility across Engineering, QA, and Product
* Prefer preventing defects through strong automation and release gates
* Enjoy building systems that scale, rather than relying on manual effort
* Comfortable enforcing 100% pass\\-rate mandates for critical workflows
* Like working on complex systems involving CI/CD, containers, and AI\\-driven logic
* Care deeply about reliability, trust, accessibility, and real\\-world user experience


**Want to learn more about HackerRank?** 
 Check out HackerRank.com to explore our products, solutions and resources, and dive into our story and mission here.
   

  

 HackerRank is a proud equal employment opportunity and affirmative action employer. We provide equal opportunity to everyone for employment based on individual performance and qualification. We never discriminate based on race, religion, national origin, gender identity or expression, sexual orientation, age, marital, veteran, or disability status. All your information will be kept confidential according to EEO guidelines.
   

  

 Linkedin \\| X \\| Blog \\| Instagram \\| Life@HackerRank
   

  

**Notice To Prospective HackerRank Job Applicants**
* Our Recruiters use @hackerrank.com email addresses.
* We never ask for payment or credit check information to apply, interview, or work here.","Software Development, Human Resources Services, and Staffing and Recruiting","https://www.linkedin.com/company/hackerrank","https://media.licdn.com/dms/image/v2/D560BAQE8MivsmbT7Ig/company-logo_100_100/company-logo_100_100/0/1705561459405/hackerrank_logo?e=2147483647&v=beta&t=vp4S1CdWAEDKNBiUwoTX0pzkI5yBufFiX725BrWZyl8","","","","","","","","","","",""
