"id","site","job_url","job_url_direct","title","company","location","date_posted","job_type","salary_source","interval","min_amount","max_amount","currency","is_remote","job_level","job_function","listing_type","emails","description","company_industry","company_url","company_logo","company_url_direct","company_addresses","company_num_employees","company_revenue","company_description","skills","experience_range","company_rating","company_reviews_count","vacancy_count","work_from_home_type"
"li-4328631029","linkedin","https://www.linkedin.com/jobs/view/4328631029","","Backend Software Development Engineer","Cisco","Bengaluru, Karnataka, India","","fulltime","","","","","",False,"entry level","Engineering and Information Technology","","","Please note this posting is to advertise potential job opportunities. This exact role may not be open today but could open in the near future. When you apply, a Cisco representative may contact you directly if a relevant position opens.
   

  

**Meet The Team**
 Cisco Spaces is the intelligence layer that turns buildings into dynamic, data\\-driven environments. By connecting to Cisco’s global network of access points, sensors and cameras, Spaces delivers real\\-time insights and automation that help organizations run safer, smarter and more sustainable workplaces.
   

  

 Today, Spaces is one of Cisco’s fastest\\-growing platforms with more than twelve billion square feet of real estate digitized worldwide. As Cisco moves deeper into a software\\-first future, Spaces sits at the center of cloud, IoT, maps, analytics and AI.
   

  

 The platform brings together everything needed for a modern hybrid workplace. It provides live occupancy and utilization insights, indoor maps, bookings, visitor flows, environmental and air\\-quality data, people and asset visibility, and automated workflows that make operations more efficient. Customers manage entire portfolios of buildings, connect third\\-party solutions through our partner ecosystem, and use our APIs to build new use cases on top of the platform.
   

  

 Spaces is where large\\-scale cloud engineering, real\\-time data, AI and enterprise UX meet. We are a team that ships fast, innovates continuously and builds technology that genuinely changes how buildings function.
   

  

 Visit our website to learn more or watch this fun video (laughs guaranteed 😂)
   

  

**Your Impact**
 As a Backend Software Engineer on the Cisco Spaces team, you will shape the core systems that power one of Cisco’s fastest\\-growing platforms. You will build the high\\-scale services that process billions of events, enable real\\-time building intelligence, and deliver reliable services to customers across the world.
   

  

* Design, implement, and deploy backend services that handle massive scale, high concurrency, and global reliability requirements.
* Build end\\-to\\-end systems in Java that prioritize performance, stability, and clean architecture.
* Develop APIs and microservices that power real\\-time occupancy, mapping, automation, IoT integrations, and analytics across thousands of enterprise sites.
* Work closely with frontend, product and platform teams to ensure seamless delivery of features that span cloud, IoT, mapping and AI layers.
* Optimize data pipelines, storage models, and streaming systems to support live telemetry from millions of connected devices.
* Introduce new technologies, frameworks, and design patterns that raise the engineering bar across the team.
* Contribute to platform\\-wide initiatives such as improving scalability, strengthening security, enhancing observability, and refining deployment and CI/CD practices.
* Learn and apply emerging AI and automation techniques where they materially improve system intelligence, accuracy, or developer efficiency.
* Own features from concept to rollout and ensure they meet the quality, reliability, and performance expected from Cisco\\-grade systems


**Minimum Qualification**
* Bachelor’s or Master’s degree in Engineering or Computer Science.
* A minimum of two years of hands\\-on experience building backend systems, web applications, and integrations in production environments.
* Strong server\\-side development expertise in Java, with experience in J2EE, Vert.x, or Kotlin\\-based services.
* Deep understanding of core Java fundamentals including threading, concurrency, synchronization, collections, generics, annotations, and JVM internals.
* Familiarity with inter\\-thread communication patterns, serialization mechanisms, and performance tuning of high\\-throughput services.
* Strong grasp of object\\-oriented programming, data structures, algorithms, and common design patterns.
* Practical experience building scalable REST APIs, backend services, and microservice architectures.
* Working knowledge of NoSQL databases and distributed data models.
* Hands\\-on experience with Kafka or similar streaming platforms, including message modeling, high\\-volume consumers, producers, and streaming pipelines.
* Exposure to building and operating services in large\\-scale cloud environments such as AWS, and comfort working with cloud\\-native services.
* Proficiency with Maven or Gradle, Git, Jenkins, CI/CD pipelines, and related engineering tooling.
* Familiarity with distributed systems concepts including service discovery, fault tolerance, and event\\-driven architectures.
* Ability to work in fast\\-paced agile teams and drive technical decisions in complex development environments.
* Comfort using modern AI development tools and assistants to enhance productivity, improve code quality, and accelerate delivery.
* Ability to rapidly learn new frameworks, libraries, and technologies as required.


**Preferred Qualifications**
* Experience designing and operating microservices at scale using Java, Vert.x, or Kotlin in high\\-throughput, low\\-latency environments.
* Hands\\-on experience running workloads on AWS, including EKS, EC2, S3, CloudWatch, IAM, Lambda or similar managed services.
* Strong familiarity with modern container and orchestration technologies such as Docker, Kubernetes, Helm, and service mesh patterns.
* Practical experience building streaming or event\\-driven architectures using Kafka, including partitions, consumer groups, offset handling, back\\-pressure strategies, and exactly\\-once semantics.
* Comfort troubleshooting distributed systems: debugging timeouts, thread starvation, queue backlogs, serialization bottlenecks, and GC/JVM performance issues.
* Experience with CI/CD, automated testing pipelines, canary deployments, observability stacks (Prometheus, Grafana, ELK), and production monitoring best practices.
* Ability to analyze complex systems, decompose problems, reason about edge cases, and make thoughtful tradeoffs between performance, reliability, and simplicity.
* Familiarity with AI\\-assisted developer tools for rapid prototyping, code generation, unit test creation, architecture exploration, and productivity amplification.
* Experience driving process improvements, standardizing patterns, automating repetitive workflows, and influencing engineering best practices across teams.
* Strong analytical mindset with the ability to interpret metrics, logs, and behavioral trends to improve system performance and operational efficiency.
* Exposure to building secure, compliant, and resilient cloud\\-native systems with proper handling of authentication, authorization, encryption, and data privacy requirements.
* Ability to thrive in a fast\\-paced environment, handle ambiguity, and contribute effectively in cross\\-functional teams involving backend, frontend, product, and platform engineering.
* Passion for continuous learning and staying updated with new frameworks, cloud capabilities, architectural approaches, and emerging technologies.


 Why Cisco?
   

  

 At Cisco, we’re revolutionizing how data and infrastructure connect and protect organizations in the AI era – and beyond. We’ve been innovating fearlessly for 40 years to create solutions that power how humans and technology work together across the physical and digital worlds. These solutions provide customers with unparalleled security, visibility, and insights across the entire digital footprint.
   

  

 Fueled by the depth and breadth of our technology, we experiment and create meaningful solutions. Add to that our worldwide network of doers and experts, and you’ll see that the opportunities to grow and build are limitless. We work as a team, collaborating with empathy to make really big things happen on a global scale. Because our solutions are everywhere, our impact is everywhere.
   

  

 We are Cisco, and our power starts with you.","Software Development","https://www.linkedin.com/company/cisco","https://media.licdn.com/dms/image/v2/D560BAQFYnR_Zrm87Dg/company-logo_100_100/B56ZnMyVr4HUAQ-/0/1760077372453/cisco_logo?e=2147483647&v=beta&t=-FnJBwOSzJBs2mZI3Vt8hsrLNZhBuwEXpMas5hClACE","","","","","","","","","","",""
"li-4347854072","linkedin","https://www.linkedin.com/jobs/view/4347854072","","Software Engineer- Web Dev- D&W Engineering","FactSet","Hyderabad, Telangana, India","","fulltime","","","","","",True,"mid-senior level","Engineering and Information Technology","","","FactSet creates flexible, open data and software solutions for over 200,000 investment professionals worldwide, providing instant access to financial data and analytics that investors use to make crucial decisions.
   

  

 At FactSet, our values are the foundation of everything we do. They express how we act and operate, serve as a compass in our decision\\-making, and play a big role in how we treat each other, our clients, and our communities. We believe that the best ideas can come from anyone, anywhere, at any time, and that curiosity is the key to anticipating our clients’ needs and exceeding their expectations.
   

  

**Your Team's Impact**
 Dealmakers and Wealth team is responsible for FactSet’s breed \\& industry leading Market Data, deep\\-dive Reporting and Research management products highlighting FactSet’s proprietary content to the global financial community. These products are used by thousands of Asset Managers, Investment Bankers, and corporate clients around the world every day to assist with investment decisions, market monitoring, company and economic analysis and sharing of buy/sell decisions and the presentation of results. D\\&W's product space represents a high growth opportunity for FactSet’s workstation count.
   

  

 The D\\&W SBU is focused on innovating the foundation of FactSet’s product offering. By marrying robust content, intuitive applications, and innovative technology, we defend and grow our footprint across several key user classes including investment banking, sell\\-side research, buy\\-side research, private equity, portfolio managers, traders, capital markets, investor relations, and media. This SBU contains Core Applications (Screening, Company \\& Security Analytics, Industry and Markets, Filings, Ownership, Research, News, Charting). The SBU closely partners with the Data Solutions and Platform Horizontals on strategy for FactSet Web, Mobile, and much of FactSet’s content offering.
   

  

**What You'll Do:\\-**
* Design, develop, and maintain web applications.
* Work with JavaScript, and modern frameworks like Vue, Angular, or React.
* Build and maintain Node.js services and APIs.
* Collaborate with cross\\-functional teams to deliver enterprise\\-level solutions.
* Understand complex systems and adopt best development practices quickly.


**What We're Looking For**
* 3 \\- 7 years of experience working professionally as a Software Developer building web application
* Proficiency in JavaScript, ES6, and TypeScript.
* Experience with Node.js and at least one modern web framework (Vue, Angular, or React).
* Strong understanding of Object\\-Oriented Design principles.
* Working knowledge of Linux OS.


**Highly Desired Skills**
* Expertise in Vue.js, TypeScript, and UI component development.
* Responsive web design and building responsive websites.
* API development and data visualization.
* Unit testing (Vitest, Jest) and E2E testing (Playwright, Cypress).
* Familiarity with CI/CD processes and tools.
* Agile methodologies (Scrum, Kanban).
* Experience with open\\-source contributions and remote team collaboration.


**What's In It For You**
 At FactSet, our people are our greatest asset, and our culture is our biggest competitive advantage. Being a FactSetter means:
   

  

* The opportunity to join an S\\&P 500 company with over 45 years of sustainable growth powered by the entrepreneurial spirit of a start\\-up.
* Support for your total well\\-being. This includes health, life, and disability insurance, as well as retirement savings plans and a discounted employee stock purchase program, plus paid time off for holidays, family leave, and company\\-wide wellness days.
* Flexible work accommodations. We value work/life harmony and offer our employees a range of accommodations to help them achieve success both at work and in their personal lives.
* A global community dedicated to volunteerism and sustainability, where collaboration is always encouraged, and individuality drives solutions.
* Career progression planning with dedicated time each month for learning and development.
* Business Resource Groups open to all employees that serve as a catalyst for connection, growth, and belonging.


**Company Overview**
 Learn more about our benefits here.
   

  

 FactSet (NYSE:FDS \\| NASDAQ:FDS) helps the financial community to see more, think bigger, and work better. Our digital platform and enterprise solutions deliver financial data, analytics, and open technology to more than 8,200 global clients, including over 200,000 individual users. Clients across the buy\\-side and sell\\-side, as well as wealth managers, private equity firms, and corporations, achieve more every day with our comprehensive and connected content, flexible next\\-generation workflow solutions, and client\\-centric specialized support. As a member of the S\\&P 500, we are committed to sustainable growth and have been recognized among the Best Places to Work in 2023 by Glassdoor as a Glassdoor Employees’ Choice Award winner. Learn more at www.factset.com and follow us on X and LinkedIn.
   

  

 At FactSet, we celebrate difference of thought, experience, and perspective. Qualified applicants will be considered for employment without regard to characteristics protected by law.","Financial Services","https://www.linkedin.com/company/factset","https://media.licdn.com/dms/image/v2/D4E0BAQGA04kR-6DdWw/company-logo_100_100/company-logo_100_100/0/1719854511297/factset_logo?e=2147483647&v=beta&t=vpyki0lvKayLem4RUT-oBtfj16xQ8oAgyGuu1946GYk","","","","","","","","","","",""
"li-4359474410","linkedin","https://www.linkedin.com/jobs/view/4359474410","https://ms.wd5.myworkdayjobs.com/External/job/Bengaluru-India/Data-Engineer-Python\\u002d\\u002dAssociate\\u002d\\u002dSoftware-Engineer_JR025666?source=LinkedIn&urlHash=nEwA","Data Engineer Python- Associate- Software Engineer","Morgan Stanley","Bengaluru, Karnataka, India","","fulltime","","","","","",False,"mid-senior level","Information Technology","","","Data Engineer Python \\- Associate\\- Software Engineering
   

  

 We’re seeking someone to join our Institutional Securities Technology team as a Data Engineer Python, in Prime Brokerage AND Institutional Equity . The Prime Brokerage Technology team works very closely with the business to provide cutting\\-edge technology, expertise and products to the business. MSPB Client Reporting Technology is currently working on modernizing client reporting platform. The work provides high visibility and opportunities to learn the business. To this end, we are in the process of recruiting a highly motivated and talented data engineer developer. Responsibilities include requirements analysis, implementing quick reporting solutions with on\\-going renovation reporting platform applications, validation of data, user \\& job support. We expect the candidate to have an interest in the financial business. This is a great opportunity for learning about a high growth, industry leading business, while fully utilizing your database and reporting technology programming skills.
   

  

 In the Technology division, we leverage innovation to build the connections and capabilities that power our Firm, enabling our clients and colleagues to redefine markets and shape the future of our communities.
   

  

 This is Associate position that develops and maintains software solutions that support business needs.
   

  

 Since 1935, Morgan Stanley is known as a global leader in financial services, always evolving and innovating to better serve our clients and our communities in more than 40 countries around the world.
   

  

**What You’ll Do In The Role**
* Working with business users to understand requirements, analyze them in detail and write clear specs and convert them into technical design
* Implementing data and reporting solutions
* Enhancing existing solutions to meet new requirements
* Addressing ad\\-hoc requests by leveraging existing tools and infrastructure or implementing
* Investigate, resolve and provide feed\\-back on data\\-quality issues
* Providing L3 production support


**What You’ll Bring To The Role**
* Experience in development of reporting systems
* Knowledge in one or all of these
* Relational Databases (Sybase, DB2, Snowflake) (Mandatory)
* PL/SQL and Stored Procedures (Mandatory)
* Python (Mandatory)
* Java (Optional)
* Analytical, debugging and problem\\-solving skills
* Team player; highly motivated; excellent communication skills
* Years of experience 3\\-5 years


**What You Can Expect From Morgan Stanley**
 We are committed to maintaining the first\\-class service and high standard of excellence that have defined Morgan Stanley for over 89 years. Our values \\- putting clients first, doing the right thing, leading with exceptional ideas, committing to diversity and inclusion, and giving back \\- aren’t just beliefs, they guide the decisions we make every day to do what's best for our clients, communities and more than 80,000 employees in 1,200 offices across 42 countries. At Morgan Stanley, you’ll find an opportunity to work alongside the best and the brightest, in an environment where you are supported and empowered. Our teams are relentless collaborators and creative thinkers, fueled by their diverse backgrounds and experiences. We are proud to support our employees and their families at every point along their work\\-life journey, offering some of the most attractive and comprehensive employee benefits and perks in the industry. There’s also ample opportunity to move about the business for those who show passion and grit in their work.
   

  

 To learn more about our offices across the globe, please copy and paste https://www.morganstanley.com/about\\-us/global\\-offices into your browser.
   

  

 Morgan Stanley is an equal opportunities employer. We work to provide a supportive and inclusive environment where all individuals can maximize their full potential. Our skilled and creative workforce is comprised of individuals drawn from a broad cross section of the global communities in which we operate and who reflect a variety of backgrounds, talents, perspectives, and experiences. Our strong commitment to a culture of inclusion is evident through our constant focus on recruiting, developing, and advancing individuals based on their skills and talents.","Financial Services","https://www.linkedin.com/company/morgan-stanley","https://media.licdn.com/dms/image/v2/C560BAQFtDpMvYgbIwA/company-logo_100_100/company-logo_100_100/0/1677778128461/morgan_stanley_logo?e=2147483647&v=beta&t=f7aAdfTeMpLPSwCGS8zQ4DtuVYuEuN3OSYQ8ksHvOsI","","","","","","","","","","",""
