"id","site","job_url","job_url_direct","title","company","location","date_posted","job_type","salary_source","interval","min_amount","max_amount","currency","is_remote","job_level","job_function","listing_type","emails","description","company_industry","company_url","company_logo","company_url_direct","company_addresses","company_num_employees","company_revenue","company_description","skills","experience_range","company_rating","company_reviews_count","vacancy_count","work_from_home_type"
"li-4343423260","linkedin","https://www.linkedin.com/jobs/view/4343423260","https://job-boards.eu.greenhouse.io/valtech/jobs/4728759101?gh_src=a5f02f92teu&urlHash=ATV7","Fronted Developer","Valtech","Ahmedabad, Gujarat, India","","contract","","","","","",False,"mid-senior level","Engineering and Information Technology","","","We are Valtech Mobility, a strategic business unit of Valtech Group, dedicated to improving mobility by making it safer, smarter and more enjoyable. Our primary goal is to develop cutting\\-edge connected vehicle technologies for global mobility providers and vehicle OEMs such as VW, Toyota, Porsche, Audi, Lamborghini, Skoda.
   

  

 As a technical expert, you'll be part of our global Connected Vehicle team. As a hidden champion and pioneer in connected vehicle technology, more than 30 million vehicles in 65 countries enjoy more than 50 different connected car services in the areas of infotainment, telematics and V2X/Car2x.
   

  

 By joining our expert panel, you will be part of the connected vehicle revolution and its next level of evolution. You will rub shoulders with international industry experts who have decades of experience working with brands such as Porsche, Lamborghini, Bentley, and Audi, to name a few.
   

  

 If you enjoy working on challenging projects in a culture that values freedom and accountability. Apply now to be contacted.
   

  

**What You Do**
* Build high\\-quality user interfaces for connected vehicle experiences spanning infotainment dashboards, portals, and complex data visualizations.
* Collaborate closely with backend and platform engineers to design contracts, optimize API consumption, and ensure reliability at scale.
* Drive performance, accessibility, and internationalization from the ground up; instrument and monitor UX KPIs to improve continuously.
* Contribute to architecture decisions, code reviews, and shared libraries; mentor peers and champion best practices.
* Take ownership of features across the full lifecycle—ideation, build, release, and operations—within a culture of freedom and accountability


**Additional Requirements**
* Experience building component libraries/design systems; proficiency with CSS\\-in\\-JS or utility\\-first frameworks (e.g., Tailwind) while keeping semantics and accessibility front\\-and\\-center.
* Exposure to web observability and monitoring tools (e.g., New Relic, Dynatrace, ELK Stack, Grafana) for front\\-end performance and user experience metrics.
* Experience automating software integration, testing, delivery, and deployment for front\\-end assets (CI/CD, bundlers, artifact management).
* Practical experience deploying to cloud platforms (Azure / AWS), infrastructure\\-as\\-code (Terraform) for front\\-end hosting/CDN configuration.
* Understanding of web security best practices (OWASP), CSP, dependency management, and threat modeling relevant to front\\-end applications.


**What We Ask**
* Ownership mindset: You take end\\-to\\-end responsibility—from design and implementation through to production operations and continuous improvement.
* Core web fundamentals: Strong proficiency in HTML, CSS (including modern layout techniques like Flexbox/Grid), and JavaScript (ES6\\+).
* Modern frameworks: Hands\\-on experience building production\\-grade applications with React and TypeScript; familiarity with Next.js for server\\-side rendering/SSG; experience with Angular (v12\\+) is a plus.
* Architecture \\& patterns: Ability to design scalable front\\-end architectures, apply design patterns, and structure large SPA/MPA codebases for maintainability.
* API integration: Deep experience integrating REST and GraphQL APIs, handling authentication, caching, pagination, and error states.
* Quality practices: Skilled in testing (unit, integration, and E2E) using tools like Jest/React Testing Library/Cypress, with a TDD mindset where appropriate.
* Performance \\& reliability: Proven track record optimizing performance (Core Web Vitals), accessibility (WCAG), internationalization, and responsive UI.
* DevOps awareness: Practical knowledge of CI/CD for front\\-end (e.g., Git\\-based workflows, build pipelines), and experience operating front\\-ends in modern cloud environments.
* Agile delivery: Experience working in agile teams (Scrum, Kanban, SAFe or similar).
* Domain curiosity: Willingness to learn the connected vehicle domain and become a subject matter expert in automotive UX and data flows.
* Communication: Excellent communication skills, strong command of English, and comfort working in globally distributed teams.


**If you do not meet all the listed qualifications or have gaps in your experience, we still encourage you to apply. At Valtech, we recognize that talent comes in many forms, and we value diverse perspectives and a willingness to learn.**
**Commitment to reaching all kinds of people**
 We design experiences that work for all kinds of people \\- and that starts with our own teams. At Valtech, we’re intentional about building an inclusive culture where everyone feels supported to grow, thrive and achieve their goals. No matter your background, you belong here. Explore our Diversity \\& Inclusion site to see how we’re creating a more equitable Valtech for all.
   

  

**The Benefits**
 This is a
 **Full\\-Time** 
 position based in
 **Ahmedabad**
**Beyond a Competitive Compensation Package, We Offer**
* Flexibility, with hybrid work options (country\\-dependent)
* Learning and development, with access to cutting\\-edge tools, training and industry experts.


 Our benefits are tailored to each location. Your Talent Partner will provide full details during the hiring process.
   

  

**Your application process**
 Once you apply, our Talent Acquisition team will review your application. If your skills and experience align with the role, we’ll reach out for next steps.
   

  

 ⚠️ Beware of recruitment fraud: Only engage with official Valtech email addresses ending in @valtech.com.
   

  

 We are committed to inclusion and accessibility. If you need reasonable accommodations during the interview process, please either indicate it in your application or let your Talent Partner know.
   

  

**About Valtech**
 Valtech is the experience innovation company that exists to unlock a better way to experience the world. By blending crafts, categories, and cultures, we help brands unlock new value in an increasingly digital world.
   

  

 At the intersection of data, AI, creativity, and technology, we drive transformation for leading organizations, including L’Oréal, Mars, Audi, P\\&G, Volkswagen Dolby, and more.
   

  

 At Valtech, we don’t just talk about transformation. We make it happen. Our people are the heart of our success, and we foster a workplace where everyone has the support to thrive, grow and innovate.
   

  

 Are you ready to create what’s next? Join us.","IT Services and IT Consulting","https://fr.linkedin.com/company/valtech","https://media.licdn.com/dms/image/v2/D4E0BAQFSPsCKDQ-lvQ/company-logo_100_100/company-logo_100_100/0/1697789289882/valtech_logo?e=2147483647&v=beta&t=sVjAKV5na8TLAMAdhu7_8zt7h95vjVInUpM06QiteXg","","","","","","","","","","",""
"li-4362503802","linkedin","https://www.linkedin.com/jobs/view/4362503802","","Advanced Python Developer - Director- Software Engineering","Morgan Stanley","Mumbai, Maharashtra, India","","fulltime","","","","","",False,"mid-senior level","Engineering and Information Technology","","","In the Technology division, we leverage innovation to build the connections and capabilities that power our Firm, enabling our clients and colleagues to redefine markets and shape the future of our communities.
   

  

 This is Director position that develops and maintains software solutions that support business needs.
   

  

 Since 1935, Morgan Stanley is known as a global leader in financial services, always evolving and innovating to better serve our clients and our communities in more than 40 countries around the world.
   

  

**What You’ll Do In The Role**
* A background in data warehouse technologies and manager or mentorship experience will be considered strong assets. Design, develop, and maintain robust, scalable backend systems in Perl or Python using object\\-oriented principles
* Implement and maintain CI/CD pipelines (preferably using Jenkins) and testing frameworks, with a strong emphasis on unit testing and test\\-driven development (TDD)
* Contribute to the modernization of our ETL and data infrastructure environment, working across full stack components·
* Develop and debug applications on Linux, leveraging shell scripting and command\\-line expertise
* Collaborate with product owners, analysts, and cross\\-functional teams in an Agile environment to deliver reliable and scalable data solutions
* Interact with various RDMBS systems such as Teradata, Sybase, DB2, or PostgreSQL
* Support data processing workloads in MPP data warehouse environments
* Manage/Mentor junior team members, provide code reviews, and contribute to knowledge sharing across the team


**What You’ll Bring To The Role**
* At least 4\\+ years' relevant experience would generally be expected to find the skills required for this role with Bachelor's/Master's Degree in Computer Science, Information Systems or related field
* Strong programming skills in Python (preferred) or Java, with solid understanding of Object\\-Oriented Programming (OOP) principles.
* If primary language is Java, familiarity with basic Python and PyPI ecosystem is expected.
* Proven experience as a senior developer, capable of designing and delivering complex solutions.
* Hands\\-on experience with RDBMS and SQL (e.g., DB2, PostgreSQL, Sybase); exposure to MPP databases like Teradata or Greenplum is a plus.
* Proficiency in Linux, including shell usage and scripting for automation tasks.
* Practical knowledge of CI/CD pipelines and Test\\-Driven Development (TDD) methodologies.


**What You Can Expect From Morgan Stanley**
 At Morgan Stanley, we raise, manage and allocate capital for our clients – helping them reach their goals. We do it in a way that’s differentiated – and we’ve done that for 90 years. Our values \\- putting clients first, doing the right thing, leading with exceptional ideas, committing to diversity and inclusion, and giving back \\- aren’t just beliefs, they guide the decisions we make every day to do what's best for our clients, communities and more than 80,000 employees in 1,200 offices across 42 countries. At Morgan Stanley, you’ll find an opportunity to work alongside the best and the brightest, in an environment where you are supported and empowered. Our teams are relentless collaborators and creative thinkers, fueled by their diverse backgrounds and experiences. We are proud to support our employees and their families at every point along their work\\-life journey, offering some of the most attractive and comprehensive employee benefits and perks in the industry. There’s also ample opportunity to move about the business for those who show passion and grit in their work.
   

  

 To learn more about our offices across the globe, please copy and paste https://www.morganstanley.com/about\\-us/global\\-offices into your browser.
   

  

 Morgan Stanley is an equal opportunities employer. We work to provide a supportive and inclusive environment where all individuals can maximize their full potential. Our skilled and creative workforce is comprised of individuals drawn from a broad cross section of the global communities in which we operate and who reflect a variety of backgrounds, talents, perspectives, and experiences. Our strong commitment to a culture of inclusion is evident through our constant focus on recruiting, developing, and advancing individuals based on their skills and talents.","Financial Services","https://www.linkedin.com/company/morgan-stanley","https://media.licdn.com/dms/image/v2/C560BAQFtDpMvYgbIwA/company-logo_100_100/company-logo_100_100/0/1677778128461/morgan_stanley_logo?e=2147483647&v=beta&t=f7aAdfTeMpLPSwCGS8zQ4DtuVYuEuN3OSYQ8ksHvOsI","","","","","","","","","","",""
"li-4365545034","linkedin","https://www.linkedin.com/jobs/view/4365545034","https://ms.wd5.myworkdayjobs.com/External/job/Bengaluru-India/Python-JAVA-Fullstack\\u002d\\u002d-Vice-President\\u002d\\u002d\\u002d\\u002dSoftware-Engineering_PT-JR025929-2?source=LinkedIn&urlHash=OlsY","Python/JAVA Fullstack - Vice President - Software Engineering","Morgan Stanley","Bengaluru, Karnataka, India","","fulltime","","","","","",False,"executive","Engineering and Information Technology","","","We’re seeking someone to join our Cyber Data Risk \\& Resilience team as a Vice President – Fullstack Lead in Cyber team. As part of Web Applications\\- Data Security team, responsible to design \\& build scalable high impact solutions. Additionally, leverage AI\\-enabled solution to improve the Firm's data security posture
   

  

**About Super Department**
 The Cybersecurity organization's mission is to create an agile, adaptable organization with the skills and expertise needed to defend against increasingly sophisticated adversaries. This will be achieved by maintaining sound capabilities to identify and protect our assets, proactively assessing threats and vulnerabilities and detecting events, ensuring resiliency through our ability to respond to and recover from incidents and building awareness and increase vigilance while continually developing our cyber workforce.
   

  

 In the Technology division, we leverage innovation to build the connections and capabilities that power our Firm, enabling our clients and colleagues to redefine markets and shape the future of our communities. This is a Lead Software Engineer position at Vice President level, which is part of the job family responsible that develops and maintains software solutions that support business needs..
   

  

 Since 1935, Morgan Stanley is known as a global leader in financial services, always evolving and innovating to better serve our clients and our communities in more than 40 countries around the world.
   

  

**What You'll Do In The Role**
* Communicate regularly with product leads across the technology organization and discuss opportunities for improvement to existing and future technology solutions.
* Develop and architect innovative solutions to enhance a high\\-performance file transfer data gateway
* Provide technical leadership and vision for software development project roadmap
* Define technical architecture and roadmap for large\\-scale, mission\\-critical systems.
* Foster a culture of innovation, collaboration, and continuous learning within the team.
* Oversee the execution of software development projects, ensuring quality and on\\-time delivery.
* Drive projects to optimize system performance, scalability, and reliability
* Develop and maintain relationships with key stakeholders to align technology solutions with business objectives.
* Analyze product performance data to drive continuous improvement.


**What you'll bring to the role:** 

* At least 6 years' relevant experience would generally be expected to find the skills required for this role.
* Strong hands\\-on experience in building large\\-scale and high\\-performance web application using Python or Java.
* Strong hands\\-on experience with full\\-stack web technologies spanning client\\-side, server\\-side, and infrastructure components, including web/application servers, load balancing, database, caching strategies, compression, security implementation, and file transfer over web.
* Experience in designing, developing, and managing file transfer services for large\\-scale enterprise solutions
* Ability to effectively manage multiple functions or guide junior staff and initiatives.
* Proven track record of leading high\\-performance engineering teams
* Ability to align technology initiatives with business objectives
* Collaboration with cross\\-functional teams and senior leadership
* Strong people management skills and fostering a collaborative team culture is a plus
* Working knowledge of C\\#/.NET is a plus


**What You Can Expect From Morgan Stanley**
 At Morgan Stanley, we raise, manage and allocate capital for our clients – helping them reach their goals. We do it in a way that’s differentiated – and we’ve done that for 90 years. Our values \\- putting clients first, doing the right thing, leading with exceptional ideas, committing to diversity and inclusion, and giving back \\- aren’t just beliefs, they guide the decisions we make every day to do what's best for our clients, communities and more than 80,000 employees in 1,200 offices across 42 countries. At Morgan Stanley, you’ll find an opportunity to work alongside the best and the brightest, in an environment where you are supported and empowered. Our teams are relentless collaborators and creative thinkers, fueled by their diverse backgrounds and experiences. We are proud to support our employees and their families at every point along their work\\-life journey, offering some of the most attractive and comprehensive employee benefits and perks in the industry. There’s also ample opportunity to move about the business for those who show passion and grit in their work.
   

  

 To learn more about our offices across the globe, please copy and paste https://www.morganstanley.com/about\\-us/global\\-offices into your browser.
   

  

 Morgan Stanley is an equal opportunities employer. We work to provide a supportive and inclusive environment where all individuals can maximize their full potential. Our skilled and creative workforce is comprised of individuals drawn from a broad cross section of the global communities in which we operate and who reflect a variety of backgrounds, talents, perspectives, and experiences. Our strong commitment to a culture of inclusion is evident through our constant focus on recruiting, developing, and advancing individuals based on their skills and talents.","Financial Services","https://www.linkedin.com/company/morgan-stanley","https://media.licdn.com/dms/image/v2/C560BAQFtDpMvYgbIwA/company-logo_100_100/company-logo_100_100/0/1677778128461/morgan_stanley_logo?e=2147483647&v=beta&t=f7aAdfTeMpLPSwCGS8zQ4DtuVYuEuN3OSYQ8ksHvOsI","","","","","","","","","","",""
