"id","site","job_url","job_url_direct","title","company","location","date_posted","job_type","salary_source","interval","min_amount","max_amount","currency","is_remote","job_level","job_function","listing_type","emails","description","company_industry","company_url","company_logo","company_url_direct","company_addresses","company_num_employees","company_revenue","company_description","skills","experience_range","company_rating","company_reviews_count","vacancy_count","work_from_home_type"
"li-4356419233","linkedin","https://www.linkedin.com/jobs/view/4356419233","https://www.inovalon.com/careers/job/?gh_jid=7588800003&gh_src=d198a36a3us&urlHash=f6qk","Full Stack Developer","Inovalon","Gurugram, Haryana, India","","fulltime","","","","","",False,"mid-senior level","Engineering and Information Technology","","","Inovalon was founded in 1998 on the belief that technology, and data specifically, would empower the transformation of the entire healthcare ecosystem for the better, improving both outcomes and economics. At Inovalon, we believe that when our customers are successful in their missions, healthcare improves. Therefore, we focus on empowering them with data\\-driven solutions. And the momentum is building.
   

  

 Together, as ONE Inovalon, we are a united force delivering solutions that address healthcare’s greatest needs. Through our mission\\-based culture of inclusion and innovation, our organization brings value not just to our customers, but to the millions of patients and members they serve.
   

  

**Overview:** 
 The Senior Software Development Engineer L4 is expected to successfully work through complex tasks independently, understand the intricacies of the software development life cycle, and display strong adherence to fundamental software engineering principles in the production of software. This position possesses a deep understanding of the computer’s architectural design and other issues like testing and scalability of software products.
   

  

**Duties and Responsibilities:**
* Work collaboratively to write high quality, testable code that meets the “Definition of Done” as it relates to team commitments;
* Utilize a “Test\\-First” approach to software development, where possible, in which the test is developed before the code;
* Participate in design and code reviews with other engineers;
* Create automated unit, system and acceptance tests and participate in test plan reviews;
* Actively support and contribute to end of iteration demos;
* Responsible for assigned integration, testing and deployment tasks;
* Work with product management to scope and estimate product enhancements;
* Design, implement, unit test software, and test software following defined processes;
* Fix software defects (internal or customer reported) following defined process;
* Actively foster continuous team improvement by being accountable for actions and continuously striving to become a better problem solver;
* Contribute to team retrospectives, helping to identify and resolve team impediments;
* Write and maintain documentation to describe program development, logic, coding, testing, changes, and corrections;
* Actively participate in the change management process as business and technical scope is adjusted;
* Adhere to all confidentiality, HIPAA, regulatory, and other such policies, procedures, and requirements as outlined within Employer’s Operating Policies and Procedures in all ways and at all times with respect to any aspect of the data handled or services rendered in the scope of work.
* Maintain compliance with Inovalon’s policies, procedures and mission statement, and fulfill those responsibilities and/or duties that may be reasonably provided by Inovalon for the purpose of achieving operational and financial success.
* On Call Policy: Participate in an on\\-call rotation to support critical issues, including outside standard business hours (evenings, weekends, and holidays), ensuring timely response and resolution as per defined SLAs.


**Job Requirements:**
* Minimum 5 years of experience with software development in one or more programming languages, and with data structures/algorithms;
* 3 years of experience testing, maintaining, or launching software products, and 1 year of experience with software design and architecture;
* Advanced design/debugging/coding skills;
* Builds Secure applications and adheres to security standards;
* Demonstrated high personal integrity and ability to earn trust from others;
* Exhibits a growth mindset, seeks feedback often and is effective in continuous personal and professional development;
* Continuously pursuing self\\-directed learning activities aimed at developing expertise within technical domain, including reading relevant publications, participating in domain forums or groups etc.;
* Ability to anticipate and look for creative ways to solve problems and apply best practices;
* Communication, organization, and teamwork skills.


**Education:**
* Bachelor's degree in computer science, Software Engineering, or Information Technology
* Master's degree or PhD in Computer Science, a related technical field, or equivalent practical experience preferred.


**Physical Demands and Work Environment:**
* Sedentary work (i.e. sitting for long periods of time).
* Exerting up to 10 pounds of force occasionally and/or negligible amount of force.
* Subject to inside environmental conditions.
* Travel for this position will include less than 10% locally usually for training purposes.


*This position is not eligible for immigration sponsorship (e.g. H\\-1B, TN, or E\\-3\\). Applicants must be authorized to work in the United States as a condition of employment. (This is only applicable for US\\-based positions)*
*If you don’t meet every qualification listed but are excited about our mission and the work described, we encourage you to apply. Inovalon is most interested in finding the best candidate for the job, and you may be just the right person for this or other roles.*
*By embracing inclusion, we enhance our work environment and drive business success. Inovalon strives to provide equal opportunities to the communities where we operate and to our clients and everyone whom we serve. We endeavor to create a culture of inclusion in which our associates feel empowered to bring their full, authentic selves to work and pursue their professional goals in an equitable setting. We understand that by fostering this type of culture, and welcoming different perspectives, we generate innovation and growth.*
*Inovalon is proud to be an equal opportunity workplace. We are committed to equal employment opportunity regardless of race, color, ancestry, religion, sex, national origin, sexual orientation, age, citizenship, marital status, disability, gender identity or veteran status. We also consider qualified applicants regardless of criminal histories, consistent with legal requirement.*
*To review the legal requirements, including all labor law posters, please visit this link*
*To review the California Consumer Privacy Statement: Disclosures for California Residents, please visit this link*","Software Development","https://www.linkedin.com/company/inovalon","https://media.licdn.com/dms/image/v2/D560BAQGsdeexu8SvbA/company-logo_100_100/company-logo_100_100/0/1685540243736/inovalon_logo?e=2147483647&v=beta&t=DEoG2ZwynbNrg9eKlqTREV9kN7KBRUZk_jiMaGRQXl0","","","","","","","","","","",""
"li-4365573873","linkedin","https://www.linkedin.com/jobs/view/4365573873","https://careers.google.com/jobs/results/90041512997331654-technical-solutions-engineer/?src=Online/LinkedIn/linkedin_us&utm_source=linkedin&utm_medium=jobposting&utm_campaign=contract&urlHash=yxy4","Technical Solutions Engineer ,Databases (English)","Google","Pune Division, Maharashtra, India","","fulltime","","","","","",False,"not applicable","Project Management, Consulting, and Engineering","","","This role requires you to work in a shift pattern or non\\-standard work hours as required. This may include weekend work.
 **Minimum qualifications:**
* Bachelor’s degree in Science, Technology, Engineering, Mathematics, or equivalent practical experience.
* 5 years of experience reading or debugging code (e.g., Java, C/C\\+\\+, Python, JavaScript, Go) and working with SQL/NoSQL databases.
* 5 years of experience in technical support, professional services, software development, or product operations management.
* Ability to communicate in English fluently to interact with regional customers and stakeholders.


**Preferred qualifications:**
* Experience administering and querying data in distributed, columnar or analytic oriented databases or distributed data processing frameworks.
* Database experience with SQL/NoSQL database administration, Google app engine, open source software communities, cloud networking solutions, or distributed computing technology.
* Knowledge of networking fundamentals (TCP/IP, Routing, VPNs, VLANs, Peering, Load Balancing, etc.), system/network administrator level knowledge of Linux/Unix or operating systems.
* Knowledge of basic web technologies (HTTP, HTML, DNS, TCP, etc.).


**About The Job**
 The Google Cloud Platform team helps customers transform and build what's next for their business — all with technology built in the cloud. Our products are developed for security, reliability and scalability, running the full stack from infrastructure to applications to devices and hardware. Our teams are dedicated to helping our customers — developers, small and large businesses, educational institutions and government agencies — see the benefits of our technology come to life. As part of an entrepreneurial team in this rapidly growing business, you will play a key role in understanding the needs of our customers and help shape the future of businesses of all sizes use technology to connect with customers, employees and partners.
   

  

 As a Technical Solutions Engineer, you will own our large and important customer issues in addition to providing level two support to our other support teams. You will be a part of a global team that provides 24x7 support to help customers seamlessly make the switch to Google Cloud.
   

  

 In this role, you will troubleshoot technical problems for customers with a mix of debugging, networking, system administration, updating documentation, and when needed, coding/scripting. You will make our products easier to adopt and use by making improvements to the product, tools, processes and documentation. You will help drive the success of Google Cloud by understanding and advocating for our customers issues.
   

  

 Google Cloud accelerates every organization’s ability to digitally transform its business and industry. We deliver enterprise\\-grade solutions that leverage Google’s technology, and tools that help developers build more sustainably. Customers in more than 200 countries and territories turn to Google Cloud as their trusted partner to enable growth and solve their most critical business problems.
   

  

**Responsibilities**
* Manage customer issues through effective diagnosis, resolution, or implementation of new investigation tools to increase productivity for customer issues on Google Cloud Platform products.
* Understand Google's product technology and architectures by troubleshooting, reproducing, determining the root cause for customer reported issues, and building tools for faster diagnosis.
* Act as a consultant and subject matter expert for internal stakeholders in engineering, sales, and customer organizations to resolve technical deployment obstacles and improve Google Cloud.
* Understand customer issues and advocate for their needs with cross\\-functional teams, including product and engineering teams to find ways to improve the product and drive quality production.
* Work as part of a team of Engineers/Consultants that globally ensure 24 hour customer support.


 Google is proud to be an equal opportunity workplace and is an affirmative action employer. We are committed to equal employment opportunity regardless of race, color, ancestry, religion, sex, national origin, sexual orientation, age, citizenship, marital status, disability, gender identity or Veteran status. We also consider qualified applicants regardless of criminal histories, consistent with legal requirements. See also Google's EEO Policy and EEO is the Law. If you have a disability or special need that requires accommodation, please let us know by completing our Accommodations for Applicants form .","Information Services and Technology, Information and Internet","https://www.linkedin.com/company/google","https://media.licdn.com/dms/image/v2/D4E0BAQGv3cqOuUMY7g/company-logo_100_100/B4EZmhegXHGcAU-/0/1759350753990/google_logo?e=2147483647&v=beta&t=zYekdwB_mnXarr4wa4kw8w3Jikm8YaakM5aiDyAyvP0","","","","","","","","","","",""
"li-4377975919","linkedin","https://www.linkedin.com/jobs/view/4377975919","","Software Engineer-Angular","Beinex","Kochi, Kerala, India","","fulltime","","","","","",False,"mid-senior level","Engineering and Information Technology","","","Job Description
 





 Beinex is looking to hire an experienced Angular Developer to join our dynamic team. As a developer, you will be responsible for creating a top\\-level coding base using Angular best practices.
 




  






 Responsibilities
 





 Implementing exciting and streamlined user experiences in responsive web applications for both desktops and mobiles/tablets
 





 Ability to design and build streamlined applications to company specifications that perfectly meet the user’s needs
 





 Designing and developing user interfaces using Angular best practices
 





 Adapting interface for modern internet applications using the latest front\\-end technologies
 





 Writing JavaScript, CSS, and HTML
 





 Developing product analysis tasks
 





 Making complex technical and design decisions for Angular projects
 





 Developing application codes and unit tests in Angular, Java Technologies, and Rest Web Services
 




  






 Key Skills \\& Requirements
 





 2\\+ years of experience as a software engineer with specific experience building front\\-end systems
 





 Previous work experience as an Angular Developer
 





 Proficient in CSS, HTML, and writing cross\\-browser compatible code
 





 Experience using JavaScript building tools like Gulp or Grunt
 





 Knowledge of JavaScript MV\\-VM/MVC frameworks, including Angular
 





 Excellent project management skills
 





 Proven experience implementing front\\-end and back\\-end JavaScript applications
 





 Excellent communication skills
 





 Critical thinker and good problem\\-solver","Business Consulting and Services","https://ae.linkedin.com/company/beinex-consulting","https://media.licdn.com/dms/image/v2/D560BAQF6mmdlVPtG9g/company-logo_100_100/B56Zv4rNXPK4AU-/0/1769403636574/beinex_consulting_logo?e=2147483647&v=beta&t=xSJ5XwXnbmdo8yl2l5BZmxPFgwP_0nbUNrpvz34_sUI","","","","","","","","","","",""
"li-4379086747","linkedin","https://www.linkedin.com/jobs/view/4379086747","https://www.hirist.com/j/software-development-engineer-test-automation-testing-1600722?utm_source=LinkedIn&utm_medium=referral&utm_campaign=linkedin_apply&ref=linkedin&urlHash=aWLm","Software Development Engineer - Test - Automation Testing","Aumni","Pune Division, Maharashtra, India","","fulltime","","","","","",False,"mid-senior level","Information Technology and Quality Assurance","","","**Job Summary**
 We are looking for a highly skilled and analytical Software Development Engineer in Test (SDET) \\- Automation with 4\\-6 years of experience in designing, developing, and maintaining automated test frameworks.
   

  

 The ideal candidate will have hands\\-on expertise in Playwright with TypeScript or Selenium with Java, along with strong exposure to API automation, CI/CD pipelines, and modern testing strategies.
   

  

 This role requires close collaboration with engineering, QA, and product teams to build scalable automation solutions, strengthen regression coverage, and ensure robust product quality across releases.
   

  

**Responsibilities**
* Design, develop, and maintain scalable automation frameworks for UI and API testing.
* Build and execute automated test scripts using Playwright (TypeScript) or Selenium (Java).
* Create and maintain test plans, test cases, and reusable test data supporting functional and regression testing.
* Perform API automation using frameworks such as RestAssured, SuperTest, or equivalent.
* Integrate automated tests into CI/CD pipelines and support continuous testing practices.
* Participate in requirement reviews, design discussions, and provide input on testability and automation feasibility.
* Troubleshoot failures, analyze logs, and support engineering teams in root cause analysis.
* Maintain detailed documentation of testing activities, defects, and automation artifacts.
* Continuously improve automation coverage and recommend best practices, tools, and frameworks.


**Core Technical Skills (Must Have)**
* Automation Frameworks : Playwright with TypeScript OR Selenium with Java (must have expertise in one).
* Programming Skills : Strong proficiency in TypeScript or Java.
* API Automation : Hands\\-on experience with Postman, RestAssured, Playwright API testing, or similar tools.
* CI/CD : Exposure to Jenkins, GitHub Actions, GitLab CI, or similar systems.
* Database : Solid understanding of SQL queries for data and backend validation.
* Version Control : Experience working with Git\\-based workflows.
* Agile : Experience working in Agile/Scrum teams and participating in sprint ceremonies.


**Good To Have Skills**
* Experience with frameworks like Cypress, WebdriverIO, or Katalon.
* Exposure to performance testing tools such as JMeter or Gatling.
* Knowledge of cloud environments (AWS, Azure, or GCP).
* Experience with BDD frameworks such as Cucumber or SpecFlow.
* Familiarity with mocking frameworks and test data automation approaches.


 About Aumni Techworks :.
   

  

 Aumni Techworks, established in 2016, is a Software Services Company that partners with Product companies to build and manage their dedicated teams in India.
   

  

 So, while you are working for a services company, you are working within a product team and growing with them.
   

  

 We do not take projects, and we have long term (open ended) contracts with our clients.
   

  

 When our clients sign up with us, they are looking at a multi\\-year relationship.
   

  

 For e.g Some of the clients we signed up 8 or 6 years, are still with us.
   

  

 We do not move people across client teams and there is no concept of bench.
   

  

 At Aumni, we believe in quality work, and we truly believe that Indian talent is at par with someone in NY, London or Germany 300\\+ and growing.
   

  

 Benefits of working at Aumni Techworks :.
   

  

 Our award\\-winning culture reminds us of our engineering days.
   

  

 Medical insurance (including Parents), Life and Disability insurance.
   

  

 24 leaves \\+ 10 public holidays \\+ leaves for Hospitalization, maternity, paternity and bereavement.
   

  

 On site Gym, TT, Carrom, Foosball and Pool table.
   

  

 Hybrid work culture.
   

  

 Fitness group / rewards.
   

  

 Friday Socials, Annual parties, treks.
   

  

 (ref:hirist.tech)","Technology, Information and Internet, Software Development, and Technology, Information and Media","https://in.linkedin.com/company/aumni-techworks","https://media.licdn.com/dms/image/v2/D4D0BAQEsP44qJ0eRXQ/company-logo_100_100/B4DZlwWPcLIYAQ-/0/1758526503189/aumni_techworks_logo?e=2147483647&v=beta&t=WQqzuc1WSa4iotXtoOTtBWhrcrDtRNi80I9Z1dYLU6k","","","","","","","","","","",""
"li-4379083849","linkedin","https://www.linkedin.com/jobs/view/4379083849","https://www.hirist.com/j/jupitice-com-technical-lead-react-jsnode-js-8-10-yrs-1616772?utm_source=LinkedIn&utm_medium=referral&utm_campaign=linkedin_apply_ref&ref=linkedin&urlHash=j4Tc","Interesting Job Opportunity: Jupitice.com - Technical Lead - React.js/Node.js","Jupitice Justice Technologies","Chandigarh, Chandigarh, India","","fulltime","","","","","",False,"mid-senior level","Information Technology","","","Job are looking for a Tech Lead to join our high\\-performance team for building and expanding the business. The ideal candidate will provide guidance on best practices throughout the entire product, from design to deployment, and be able to perform regular code and design Rich technology experience and good exposure to latest advancements in Technology \\- bringing innovative solutions to the table
   

  

* Rapidly translate product requirements to application/software level architecture and elegantly detailed designs
* Work in all phase of an agile software development life cycle, including collecting requirements, suggesting methodologies and technologies, and release planning
* Ability to identify with the goals of the product, and dedicate yourself to delivering on the commitments you and your team make to them
* Experience in working with multi\\-location teams
* Experience working on large, complex systems
* Strong written and verbal communication skills
* Comprehensive understanding of the Agile Development process
* Actively supported software quality assurance reviews and monitoring activities
* Working with a cross discipline team of User Experience, Visual Design, Project Management, Development, and Testing


**Skills**
* Hands on experience in designing E2E solutions, optimization and best practice implementations.
* Hands\\-on experience with developing microservices with NodeJS and with a good knowledge of its ecosystems.
* Must have experience in environments include Git, REST APIs, Agile Scrum, Selenium WebDriver, HTML 5, CSS (LESS/SASS), Front Hand technology framework (AngularJS/ ReactJS/VueJs)
* Solid knowledge of design patterns and OOPS principles
* Hands\\-on experience with MySQL, Redis, API Gateway \\& Elasticsearch and as well as a good amount of experience working with AWS or any Cloud
* Must have integrated third\\-party services like any payment gateway etc.
* Unit testing and mocking frameworks
* Knowledge of Jira/Confluence


**Good To Have**
* Mobile development experience (native, hybrid or browser\\-based)
* NodeJS, Java/Kotlin, Objective\\-C, Swift
* GraphQL or RESTful web services and consuming APIs in a mobile interface


 (ref:hirist.tech)","Technology, Information and Internet, Software Development, and Technology, Information and Media","https://in.linkedin.com/company/jupitice","https://media.licdn.com/dms/image/v2/D560BAQEXS2P-TI7lXw/company-logo_100_100/B56ZdTmx2.GQAc-/0/1749454364760/jupitice_logo?e=2147483647&v=beta&t=x6v8ULucLVXwlc2fkYdLyazDQOJX28yT1sau_p8U7Eg","","","","","","","","","","",""
