"id","site","job_url","job_url_direct","title","company","location","date_posted","job_type","salary_source","interval","min_amount","max_amount","currency","is_remote","job_level","job_function","listing_type","emails","description","company_industry","company_url","company_logo","company_url_direct","company_addresses","company_num_employees","company_revenue","company_description","skills","experience_range","company_rating","company_reviews_count","vacancy_count","work_from_home_type"
"li-4344932561","linkedin","https://www.linkedin.com/jobs/view/4344932561","","Software Engineer","Cisco","Bengaluru, Karnataka, India","","fulltime","","","","","",False,"mid-senior level","Engineering and Information Technology","","","**Meet the team**
 Cisco has revolutionized the internet through decades of innovation in WAN engineering, and we’re now reinventing WAN with sophisticated, controller\\-based software\\-defined solutions for intent\\-based networking. Our technology enables secure, reliable connectivity for users and devices to applications anywhere—cloud, on\\-premise, or SaaS. As part of the Catalyst Engineering Routing team, you'll help build industry\\-leading SD\\-WAN and edge routing platforms, working on scalable, distributed systems in areas like routing, security, analytics, telemetry, and machine learning.
   

  

**Join our dynamic team to learn, innovate, and invent the future of intelligent networking in an open and collaborative environment.**
**Your impact**
 In this role, you'll work with cutting\\-edge SDWAN and edge routing technologies, helping to define and develop innovative features and architectures for next\\-generation routing products. You'll collaborate with teams on new ASIC designs, craft and test forwarding components, and contribute to creative projects in a dynamic engineering environment. Our team values collaboration, learning, quality, and customer impact. If you're passionate about problem\\-solving, driving change, and influencing network behaviour across cross\\-functional teams, this opportunity is for you.
   

  

**Required Skills**
 We are seeking 5\\+ years of expert software developer in networking, focusing on platform and system software, device drivers, and performance engineering in Linux/UNIX environments.
   

  

* Strong C programming skills, with experience in large codebases, source code control systems, and device driver development.
* Proven understanding of LAN/WAN communication interfaces and Layer 2/Layer 3 networking technologies.
* Proficiency with hardware/software debugging tools (e.g., GDB, Arium, BDI or equivalent experience) and scripting/automation using Shell, Python, Perl, TCL
* Consistent record to develop, improve, and sustain embedded system software as part of multi\\-functional teams building innovative Cisco networking products.


**Good To Have**
* Expertise in kernel bring\\-up, driver development, and cloud networking.
* Skilled in debugging hardware interfaces (i2c, PCIe) and familiar with X86/ARM assembly; DPDK experience
* Strong communicator and teammate, delivering quality results in fast\\-paced environments.


 Why Cisco?
   

  

 At Cisco, we’re revolutionizing how data and infrastructure connect and protect organizations in the AI era – and beyond. We’ve been innovating fearlessly for 40 years to create solutions that power how humans and technology work together across the physical and digital worlds. These solutions provide customers with unparalleled security, visibility, and insights across the entire digital footprint.
   

  

 Fueled by the depth and breadth of our technology, we experiment and create meaningful solutions. Add to that our worldwide network of doers and experts, and you’ll see that the opportunities to grow and build are limitless. We work as a team, collaborating with empathy to make really big things happen on a global scale. Because our solutions are everywhere, our impact is everywhere.
   

  

 We are Cisco, and our power starts with you.","Software Development","https://www.linkedin.com/company/cisco","https://media.licdn.com/dms/image/v2/D560BAQFYnR_Zrm87Dg/company-logo_100_100/B56ZnMyVr4HUAQ-/0/1760077372453/cisco_logo?e=2147483647&v=beta&t=-FnJBwOSzJBs2mZI3Vt8hsrLNZhBuwEXpMas5hClACE","","","","","","","","","","",""
"li-4344923005","linkedin","https://www.linkedin.com/jobs/view/4344923005","","Data Engineer I, ITC","Nike","Karnataka, India","","fulltime","","","","","",False,"mid-senior level","Information Technology","","","**Who You’ll Work With**
 You will be a part of the larger Global Technology organization working on Nike’s internal product tools and report to the team’s Engineering Director. You will work day\\-to\\-day with a team of engineers, the team’s Technical Product Manager and Principal Engineers in the organization on software projects to achieve Nike’s business objectives. You will also engage with other Global Technology functions and teams on organizational and technical goals.
   

  

**Who We Are Looking For**
 We’re looking for a Data Engineer to solve complex software engineering problems supporting Nike’s pursuit of delivering state of the art tools to our Consumer Product and Innovation (CP\\&I) community. The candidate needs to be highly collaborative with peers, productive in a fast\\-paced development environment and have depth of native cloud software engineering experience.
   

  

**What You’ll Work On**
 You will be part of and leading a team of engineers building out tooling for our Consumer Product \\& Innovation team members. We are investing in building modular, configurable and “API\\-First” capabilities which will be consumed by modern web applications build with the most recent SPA frameworks. You are expected to help coordinate with other teams and provide guidance and coaching for more junior team members.
   

  

* Bachelor's degree in Computer Science, Engineering, Data Science, or related field; or equivalent combination of education
* 1\\-2\\+ years of hands\\-on experience in data engineering, software development, or related technical roles
* Foundational proficiency in SQL for data querying and manipulation, with basic working knowledge of Python for data processing, scripting, and automation tasks
* Exposure to Spark or similar distributed data processing frameworks, with understanding of big data concepts and parallel computing principles
* Familiarity with at least one major cloud platform (AWS, Azure, Databricks, or Snowflake) and understanding of cloud\\-based data storage and processing services.
* Basic understanding of data modeling, ETL/ELT processes, and data pipeline fundamentals, with awareness of data streaming technologies and real\\-time data processing concepts
* Knowledge of version control systems (Git), CI/CD concepts, and DevOps practices related to data engineering workflows and automated deployment pipelines.
* Exposure to REST API development and data service integration, with understanding of microservices architecture concepts and basic architectural design patterns
* Awareness of data visualization concepts and dashboard design principles; experience with frameworks such as React, Vue.js, or Angular is a plus.
* Strong problem\\-solving skills, collaborative mindset, and ability to work effectively in highly collaborative environments with demonstrated learning agility and attention to detail","Retail","https://www.linkedin.com/company/nike","https://media.licdn.com/dms/image/v2/D560BAQHJk7IdfuV1Dw/company-logo_100_100/company-logo_100_100/0/1732131503851/nike_logo?e=2147483647&v=beta&t=qF7rqr8Es8BnExo0QJcZr_vvtzGkir2vjZAg4fcS9hY","","","","","","","","","","",""
"li-4319422464","linkedin","https://www.linkedin.com/jobs/view/4319422464","","Frontend Developer (Next.js)","BayOne Solutions","","","fulltime","","","","","",False,"associate","Information Technology","","","**Job Summary:** 



* Architect, design, and develop scalable and performant full\\-stack web applications, leading the development of front\\-end (React/Next.js) and back\\-end (Java/Node.js) components.
* Front\\-End Development (React/Next.js): Develop dynamic, responsive, and interactive user interfaces using React/Next.js, focusing on writing clean, modular, and maintainable code.
* Node.js Services: Design and implement efficient, event\\-driven, and scalable services using Node.js, ensuring high availability and performance.
* Collaboration: Work closely with product managers, designers, QA engineers, and other stakeholders to deliver high\\-quality software solutions.
* Code Reviews \\& Best Practices: Participate in peer code reviews to ensure best practices for software development, including testing and deployment.
* Performance Optimization: Focus on optimizing performance, including database queries, and addressing scaling issues to handle increasing load and traffic efficiently.
* Agile Methodology: Participate in Agile development processes, including sprint planning and retrospectives, and contribute to continuous improvements in engineering practices.



  





**What You’ll Bring \\| Skills \\& Experience:** 



* Bachelor’s degree in computer science or equivalent experience.
* 5\\+ years of total related experience.
* JavaScript: 4\\+ years of experience building scalable web applications using JavaScript, HTML, CSS, and related frontend technologies.
* React/Next.js: 2\\+ years of experience with React/Next.js, including state management (e.g., Redux, Context), hooks, component\\-based architecture, and responsive design.
* Node.js: 1\\+ years of experience developing server\\-side applications with Node.js, including experience with RESTful APIs and GraphQL.
* Databases: Hands\\-on experience with relational (e.g., PostgreSQL, MySQL) and NoSQL (e.g., MongoDB) databases, including schema design, query optimization, and transactions.
* Cloud \\& DevOps: Familiarity with cloud platforms (AWS, Azure, GCP) and containerization tools (e.g., Docker, Kubernetes).
* API Design: Expertise in designing and consuming RESTful APIs, working with third\\-party APIs, and ensuring secure and efficient data flow across services.
* Unit Testing: Experience with automated testing frameworks (e.g., JUnit, Mocha, PyTest) and a strong focus on test\\-driven development (TDD) for both back\\-end and front\\-end code.
* Version Control: Proficiency in Git, including branching, pull requests, and managing large codebases.
* Agile Methodologies: Experience working in Agile teams using Scrum or Kanban methodologies.
* Problem\\-Solving \\& Leadership: Strong analytical skills with a passion for solving technical problems.
* Communication \\& Collaboration: Excellent verbal and written communication skills, with the ability to explain technical concepts to both technical and non\\-technical stakeholders. A collaborative mindset with the ability to work effectively across cross\\-functional teams.","IT Services and IT Consulting","https://www.linkedin.com/company/bayone-solutions","https://media.licdn.com/dms/image/v2/D560BAQFB2EacVt_3mw/company-logo_100_100/company-logo_100_100/0/1720628480768/bayone_solutions_logo?e=2147483647&v=beta&t=c_zZs1NIDcyTHiQf78pNZyUmZqegMbJouSiCDXH7AIs","","","","","","","","","","",""
"li-4344804095","linkedin","https://www.linkedin.com/jobs/view/4344804095","","MERN Stack Developer (Intern)","EnglishBhashi","Bengaluru, Karnataka, India","","internship","","","","","",False,"associate","Engineering and Information Technology","","","**About The Role**
 We are looking for a passionate MERN Stack Developer Intern who is eager to learn and contribute to real\\-world projects. The ideal candidate should have hands\\-on experience with JavaScript, the MERN stack, modern development workflows, and AI\\-powered coding tools like Cursor, GitHub Copilot, or similar.
   

  

 You will work closely with our engineering team to build scalable applications, automate workflows, and contribute to improving our CI/CD pipeline and cloud infrastructure.
   

  

 Key Responsibilities
   

  

* Develop, maintain, and optimize web applications using the MERN stack (MongoDB, Express.js, React.js/Next.js, Node.js).
* Work with Next.js for server\\-side rendering, routing, API routes, and performance optimization.
* Use AI development tools (Cursor, GitHub Copilot, Codeium, etc.) to speed up development and improve code quality.
* Collaborate via GitHub for version control, pull requests, code reviews, and branching workflows.
* Assist in setting up and maintaining CI/CD pipelines using GitHub Actions or similar tools.
* Support cloud deployments on AWS (EC2, S3, Lambda, CloudFront, etc.).
* Troubleshoot and fix bugs, optimize performance, and improve user experience.
* Work with APIs, database schemas, and server\\-side logic.
* Participate in sprint discussions, documentation, and technical brainstorming sessions.


**Required Skills**
* Good understanding of JavaScript, ES6\\+, and asynchronous programming.
* Basic to intermediate experience with the MERN stack:
+ MongoDB
+ Express.js
+ React.js / Next.js
+ Node.js

* Familiarity with Git \\& GitHub workflows (clone, commit, push, pull requests).
* Experience using AI coding tools like Cursor, GitHub Copilot, or similar.
* Understanding of REST APIs and JSON.
* Basic knowledge of AWS services and cloud deployment workflows.
* Knowledge of CI/CD pipelines (GitHub Actions preferred).
* Strong problem\\-solving and debugging skills.
* Ability to learn quickly and work in a fast\\-paced environment.


 Good to Have (Optional)
   

  

* Knowledge of Docker or containerized apps.
* Experience working with Tailwind CSS or Material UI.
* Understanding of JWT authentication and role\\-based access control.
* Experience with AWS EC2, S3, and Vercel.
* Knowledge of Agile/Scrum development.


 Eligibility
   

  

* Pursuing or recently completed a Bachelor's degree in CS, IT, or related field.
* Basic project portfolio (GitHub links, live projects, or assignments).
* Good communication and teamwork skills.


**Benefits**
* Hands\\-on experience with industry\\-standard tech stack \\& tools.
* Exposure to real\\-world production apps, deployment pipelines, and cloud platforms.
* Mentorship from experienced developers.
* Certificate of Internship \\& Letter of Recommendation (based on performance).


**Possibility of a pre\\-placement offer (PPO) for high\\-performing interns.**
**Note:** 
 This is a paid internship.Skills: express.js,next.js,node.js,cd,github,mern stack,mongodb,ci,aws,react.js,pipelines","Education","https://in.linkedin.com/company/englishbhashi","https://media.licdn.com/dms/image/v2/D560BAQHK_iu1V2Gx7A/company-logo_100_100/company-logo_100_100/0/1731953617994/englishbhashi_logo?e=2147483647&v=beta&t=6WrpyUc6sedqxMlk7cIqr-lXuRoIphkbbHaYPb91NyA","","","","","","","","","","",""
"li-4344873228","linkedin","https://www.linkedin.com/jobs/view/4344873228","","Data Engineer I, ITC","Nike","Karnataka, India","","fulltime","","","","","",False,"mid-senior level","Information Technology","","","**Who You’ll Work With**
 You will be a part of the larger Global Technology organization working on Nike’s internal product tools and report to the team’s Engineering Director. You will work day\\-to\\-day with a team of engineers, the team’s Technical Product Manager and Principal Engineers in the organization on software projects to achieve Nike’s business objectives. You will also engage with other Global Technology functions and teams on organizational and technical goals.
   

  

**Who We Are Looking For**
 We’re looking for a Data Engineer to solve complex software engineering problems supporting Nike’s pursuit of delivering state of the art tools to our Consumer Product and Innovation (CP\\&I) community. The candidate needs to be highly collaborative with peers, productive in a fast\\-paced development environment and have depth of native cloud software engineering experience.
   

  

**What You’ll Work On**
 You will be part of and leading a team of engineers building out tooling for our Consumer Product \\& Innovation team members. We are investing in building modular, configurable and “API\\-First” capabilities which will be consumed by modern web applications build with the most recent SPA frameworks. You are expected to help coordinate with other teams and provide guidance and coaching for more junior team members.
   

  

* Bachelor's degree in Computer Science, Engineering, Data Science, or related field; or equivalent combination of education
* 1\\-2\\+ years of hands\\-on experience in data engineering, software development, or related technical roles
* Foundational proficiency in SQL for data querying and manipulation, with basic working knowledge of Python for data processing, scripting, and automation tasks
* Exposure to Spark or similar distributed data processing frameworks, with understanding of big data concepts and parallel computing principles
* Familiarity with at least one major cloud platform (AWS, Azure, Databricks, or Snowflake) and understanding of cloud\\-based data storage and processing services
* Basic understanding of data modeling, ETL/ELT processes, and data pipeline fundamentals, with awareness of data streaming technologies and real\\-time data processing concepts
* Knowledge of version control systems (Git), CI/CD concepts, and DevOps practices related to data engineering workflows and automated deployment pipelines
* Exposure to REST API development and data service integration, with understanding of microservices architecture concepts and basic architectural design patterns
* Awareness of data visualization concepts and dashboard design principles; experience with frameworks such as React, Vue.js, or Angular is a plus
* Strong problem\\-solving skills, collaborative mindset, and ability to work effectively in highly collaborative environments with demonstrated learning agility and attention to detail","Retail","https://www.linkedin.com/company/nike","https://media.licdn.com/dms/image/v2/D560BAQHJk7IdfuV1Dw/company-logo_100_100/company-logo_100_100/0/1732131503851/nike_logo?e=2147483647&v=beta&t=qF7rqr8Es8BnExo0QJcZr_vvtzGkir2vjZAg4fcS9hY","","","","","","","","","","",""
"li-4345020516","linkedin","https://www.linkedin.com/jobs/view/4345020516","","Software Engineer III, Embedded Systems, Firmware","Google","Bengaluru, Karnataka, India","","fulltime","","","","","",False,"not applicable","Information Technology and Engineering","","","**Minimum qualifications:**
* Bachelor's degree in Electrical, Electronics or Computer, or equivalent practical experience.
* 2 years of experience in development, testing and deployment of consumer electronics/embedded systems.
* Experience with embedded systems, Real\\-Time Operating System (RTOS), firmware, or device drivers.
* Experience with embedded programming in C/C\\+\\+.


**Preferred qualifications:**
* Experience in electrical, electronics or a computer field with embedded domain, data structures and algorithms, and software design.
* Experience in working with hardware designers and reading schematics.
* Experience with interface protocols (e.g., USB, SPI, I2C, Universal Asynchronous Receiver/Transmitter (UART), Universal Flash Storage (UFS), Peripheral Component Interconnect Express (PCIe)), power management, system integration, software stacks, drivers.
* Experience with ARM or other System on a chip (SoC) architectures, memory system, fabric, with performance analysis and optimization.
* Knowledge of embedded systems development, RTOS concepts, device drivers, hardware/software integration, ARM, system BIOS and device drivers.


**About the job** 
 Google's software engineers develop the next\\-generation technologies that change how billions of users connect, explore, and interact with information and one another. Our products need to handle information at massive scale, and extend well beyond web search. We're looking for engineers who bring fresh ideas from all areas, including information retrieval, distributed computing, large\\-scale system design, networking and data storage, security, artificial intelligence, natural language processing, UI design and mobile; the list goes on and is growing every day. As a software engineer, you will work on a specific project critical to Google’s needs with opportunities to switch teams and projects as you and our fast\\-paced business grow and evolve. We need our engineers to be versatile, display leadership qualities and be enthusiastic to take on new problems across the full\\-stack as we continue to push technology forward.
   

  

 The Silicon Software team develops software for a variety of custom silicon for internal and external customers.
   

  

 In this role, you will be developing software across Platform software (e.g., Board Support Package (BSP), firmware, drivers) delivered to the customers.Google's mission is to organize the world's information and make it universally accessible and useful. Our team combines the best of Google AI, Software, and Hardware to create radically helpful experiences. We research, design, and develop new technologies and hardware to make computing faster, seamless, and more powerful. We aim to make people's lives better through technology.
   

  

**Responsibilities**
* Work on hardware and software.
* Work to enable device drivers for applications on devices.
* Develop new software, hardware, and system architecture to support future applications.
* Design, develop, and test embedded software drivers for the next generation smart devices.


 Google is proud to be an equal opportunity workplace and is an affirmative action employer. We are committed to equal employment opportunity regardless of race, color, ancestry, religion, sex, national origin, sexual orientation, age, citizenship, marital status, disability, gender identity or Veteran status. We also consider qualified applicants regardless of criminal histories, consistent with legal requirements. See also Google's EEO Policy and EEO is the Law. If you have a disability or special need that requires accommodation, please let us know by completing our Accommodations for Applicants form .","Information Services and Technology, Information and Internet","https://www.linkedin.com/company/google","https://media.licdn.com/dms/image/v2/D4E0BAQGv3cqOuUMY7g/company-logo_100_100/B4EZmhegXHGcAU-/0/1759350753990/google_logo?e=2147483647&v=beta&t=zYekdwB_mnXarr4wa4kw8w3Jikm8YaakM5aiDyAyvP0","","","","","","","","","","",""
