"id","site","job_url","job_url_direct","title","company","location","date_posted","job_type","salary_source","interval","min_amount","max_amount","currency","is_remote","job_level","job_function","listing_type","emails","description","company_industry","company_url","company_logo","company_url_direct","company_addresses","company_num_employees","company_revenue","company_description","skills","experience_range","company_rating","company_reviews_count","vacancy_count","work_from_home_type"
"li-4336187801","linkedin","https://www.linkedin.com/jobs/view/4336187801","https://careers.capgemini.com/job/Hyderabad-Software-Engineer/1266927201/?feedId=388933&utm_source=LinkedInJobPostings&urlHash=g1tw","Software Engineer","Capgemini","Hyderabad, Telangana, India","","internship","","","","","",False,"mid-senior level","Engineering and Information Technology","","","**Job Description**
 Works in the area of Software Engineering, which encompasses the development, maintenance and optimization of software solutions/applications.
   

  

* Applies scientific methods to analyse and solve software engineering problems.
* He/she is responsible for the development and application of software engineering practice and knowledge, in research, design, development and maintenance.
* His/her work requires the exercise of original thought and judgement and the ability to supervise the technical and administrative work of other software engineers.
* The software engineer builds skills and expertise of his/her software engineering discipline to reach standard software engineer skills expectations for the applicable role, as defined in Professional Communities.
* The software engineer collaborates and acts as team player with other software engineers and stakeholders.


 Works in the area of Software Engineering, which encompasses the development, maintenance and optimization of software solutions/applications.1\\. Applies scientific methods to analyse and solve software engineering problems.2\\. He/she is responsible for the development and application of software engineering practice and knowledge, in research, design, development and maintenance.3\\. His/her work requires the exercise of original thought and judgement and the ability to supervise the technical and administrative work of other software engineers.4\\. The software engineer builds skills and expertise of his/her software engineering discipline to reach standard software engineer skills expectations for the applicable role, as defined in Professional Communities.5\\. The software engineer collaborates and acts as team player with other software engineers and stakeholders.
   

  

**Job Description \\- Grade Specific**
 Has more than a year of relevant work experience. Solid understanding of programming concepts, software design and software development principles. Consistently works to direction with minimal supervision, producing accurate and reliable results. Individuals are expected to be able to work on a range of tasks and problems, demonstrating their ability to apply their skills and knowledge. Organises own time to deliver against tasks set by others with a mid term horizon. Works co\\-operatively with others to achieve team goals and has a direct and positive impact on project performance and make decisions based on their understanding of the situation, not just the rules.
   

  

 Skills (competencies)
   

  

 Verbal Communication","IT Services and IT Consulting","https://fr.linkedin.com/company/capgemini","https://media.licdn.com/dms/image/v2/D4E0BAQEygLYzCX_Eyw/company-logo_100_100/B4EZokv4W0HcAQ-/0/1761553123167/capgemini_logo?e=2147483647&v=beta&t=xG3EmbNVlc7SRrVZ6PRO-00iirsdvztT1TasylO58zE","","","","","","","","","","",""
"li-4337111899","linkedin","https://www.linkedin.com/jobs/view/4337111899","","Backend Software Development Engineer","Cisco","Bengaluru, Karnataka, India","","fulltime","","","","","",False,"entry level","Engineering and Information Technology","","","Please note this posting is to advertise potential job opportunities. This exact role may not be open today but could open in the near future. When you apply, a Cisco representative may contact you directly if a relevant position opens.
   

  

**Meet The Team**
 Cisco Spaces is the intelligence layer that turns buildings into dynamic, data\\-driven environments. By connecting to Cisco’s global network of access points, sensors and cameras, Spaces delivers real\\-time insights and automation that help organizations run safer, smarter and more sustainable workplaces.
   

  

 Today, Spaces is one of Cisco’s fastest\\-growing platforms with more than twelve billion square feet of real estate digitized worldwide. As Cisco moves deeper into a software\\-first future, Spaces sits at the center of cloud, IoT, maps, analytics and AI.
   

  

 The platform brings together everything needed for a modern hybrid workplace. It provides live occupancy and utilization insights, indoor maps, bookings, visitor flows, environmental and air\\-quality data, people and asset visibility, and automated workflows that make operations more efficient. Customers manage entire portfolios of buildings, connect third\\-party solutions through our partner ecosystem, and use our APIs to build new use cases on top of the platform.
   

  

 Spaces is where large\\-scale cloud engineering, real\\-time data, AI and enterprise UX meet. We are a team that ships fast, innovates continuously and builds technology that genuinely changes how buildings function.
   

  

**Your Impact**
 As a Backend Software Engineer on the Cisco Spaces team, you will shape the core systems that power one of Cisco’s fastest\\-growing platforms. You will build the high\\-scale services that process billions of events, enable real\\-time building intelligence, and deliver reliable services to customers across the world.
   

  

* Design, implement, and deploy backend services that handle massive scale, high concurrency, and global reliability requirements.
* Build end\\-to\\-end systems in Java that prioritize performance, stability, and clean architecture.
* Develop APIs and microservices that power real\\-time occupancy, mapping, automation, IoT integrations, and analytics across thousands of enterprise sites.
* Work closely with frontend, product and platform teams to ensure seamless delivery of features that span cloud, IoT, mapping and AI layers.
* Optimize data pipelines, storage models, and streaming systems to support live telemetry from millions of connected devices.
* Introduce new technologies, frameworks, and design patterns that raise the engineering bar across the team.
* Contribute to platform\\-wide initiatives such as improving scalability, strengthening security, enhancing observability, and refining deployment and CI/CD practices.
* Learn and apply emerging AI and automation techniques where they materially improve system intelligence, accuracy, or developer efficiency.
* Own features from concept to rollout and ensure they meet the quality, reliability, and performance expected from Cisco\\-grade systems


**Minimum Qualification**
* Bachelor’s or Master’s degree in Engineering or Computer Science.
* A minimum of two years of hands\\-on experience building backend systems, web applications, and integrations in production environments.
* Strong server\\-side development expertise in Java, with experience in J2EE, Vert.x, or Kotlin\\-based services.
* Deep understanding of core Java fundamentals including threading, concurrency, synchronization, collections, generics, annotations, and JVM internals.
* Familiarity with inter\\-thread communication patterns, serialization mechanisms, and performance tuning of high\\-throughput services.
* Strong grasp of object\\-oriented programming, data structures, algorithms, and common design patterns.
* Practical experience building scalable REST APIs, backend services, and microservice architectures.
* Working knowledge of NoSQL databases and distributed data models.
* Hands\\-on experience with Kafka or similar streaming platforms, including message modeling, high\\-volume consumers, producers, and streaming pipelines.
* Exposure to building and operating services in large\\-scale cloud environments such as AWS, and comfort working with cloud\\-native services.
* Proficiency with Maven or Gradle, Git, Jenkins, CI/CD pipelines, and related engineering tooling.
* Familiarity with distributed systems concepts including service discovery, fault tolerance, and event\\-driven architectures.
* Ability to work in fast\\-paced agile teams and drive technical decisions in complex development environments.
* Comfort using modern AI development tools and assistants to enhance productivity, improve code quality, and accelerate delivery.
* Ability to rapidly learn new frameworks, libraries, and technologies as required.


**Preferred Qualifications**
* Experience designing and operating microservices at scale using Java, Vert.x, or Kotlin in high\\-throughput, low\\-latency environments.
* Hands\\-on experience running workloads on AWS, including EKS, EC2, S3, CloudWatch, IAM, Lambda or similar managed services.
* Strong familiarity with modern container and orchestration technologies such as Docker, Kubernetes, Helm, and service mesh patterns.
* Practical experience building streaming or event\\-driven architectures using Kafka, including partitions, consumer groups, offset handling, back\\-pressure strategies, and exactly\\-once semantics.
* Comfort troubleshooting distributed systems: debugging timeouts, thread starvation, queue backlogs, serialization bottlenecks, and GC/JVM performance issues.
* Experience with CI/CD, automated testing pipelines, canary deployments, observability stacks (Prometheus, Grafana, ELK), and production monitoring best practices.
* Ability to analyze complex systems, decompose problems, reason about edge cases, and make thoughtful tradeoffs between performance, reliability, and simplicity.
* Familiarity with AI\\-assisted developer tools for rapid prototyping, code generation, unit test creation, architecture exploration, and productivity amplification.
* Experience driving process improvements, standardizing patterns, automating repetitive workflows, and influencing engineering best practices across teams.
* Strong analytical mindset with the ability to interpret metrics, logs, and behavioral trends to improve system performance and operational efficiency.
* Exposure to building secure, compliant, and resilient cloud\\-native systems with proper handling of authentication, authorization, encryption, and data privacy requirements.
* Ability to thrive in a fast\\-paced environment, handle ambiguity, and contribute effectively in cross\\-functional teams involving backend, frontend, product, and platform engineering.
* Passion for continuous learning and staying updated with new frameworks, cloud capabilities, architectural approaches, and emerging technologies.


 Why Cisco?
   

  

 At Cisco, we’re revolutionizing how data and infrastructure connect and protect organizations in the AI era – and beyond. We’ve been innovating fearlessly for 40 years to create solutions that power how humans and technology work together across the physical and digital worlds. These solutions provide customers with unparalleled security, visibility, and insights across the entire digital footprint.
   

  

 Fueled by the depth and breadth of our technology, we experiment and create meaningful solutions. Add to that our worldwide network of doers and experts, and you’ll see that the opportunities to grow and build are limitless. We work as a team, collaborating with empathy to make really big things happen on a global scale. Because our solutions are everywhere, our impact is everywhere.
   

  

 We are Cisco, and our power starts with you.","Software Development","https://www.linkedin.com/company/cisco","https://media.licdn.com/dms/image/v2/D560BAQFYnR_Zrm87Dg/company-logo_100_100/B56ZnMyVr4HUAQ-/0/1760077372453/cisco_logo?e=2147483647&v=beta&t=-FnJBwOSzJBs2mZI3Vt8hsrLNZhBuwEXpMas5hClACE","","","","","","","","","","",""
"li-4310812045","linkedin","https://www.linkedin.com/jobs/view/4310812045","","Senior Software Engineer","Roku","Bengaluru, Karnataka, India","","fulltime","","","","","",False,"mid-senior level","Engineering and Information Technology","","","Teamwork makes the stream work.
 
  
 


**Roku is changing how the world watches TV** 

 Roku is the \\#1 TV streaming platform in the U.S., Canada, and Mexico, and we've set our sights on powering every television in the world. Roku pioneered streaming to the TV. Our mission is to be the TV streaming platform that connects the entire TV ecosystem. We connect consumers to the content they love, enable content publishers to build and monetize large audiences, and provide advertisers unique capabilities to engage consumers.
 



 From your first day at Roku, you'll make a valuable \\- and valued \\- contribution. We're a fast\\-growing public company where no one is a bystander. We offer you the opportunity to delight millions of TV streamers around the world while gaining meaningful experience across a variety of disciplines.
 



  
 



  
 



 About the role
 

  
 


 A highly scalable, highly available, real\\-time advertising platform is critical to support and grow Roku's rapidly expanding ad business. It is the mission of the Ad Engineering Team to build this platform. We are hiring a Senior Software Engineer, Advertising Platform, to be a vital part of this mission. If you bring extensive experience building complex systems, love great technology at scale, enjoy mentoring, jumping in, and figuring things out in any system, this role is for you!
 

  
 



 What you'll be doing 
 * Work alongside a highly skilled engineering team to design, develop, and maintain large scale, highly performant, real\\-time applications.
* Own building features, driving directly with product and other engineering teams
* Demonstrate excellent communication skills in working with technical and non\\-technical audiences
* Be an evangelist for best practices across all functions – developers, QA, and infrastructure/ops
* Be an evangelist for platform innovation and reuse
* Deliver top\\-quality software in a timely fashion


 We're excited if you have
 * 9\\+ years of experience building large scale and low latency distributed systems.
* Command of Java or C\\+\\+.
* Solid understanding of algorithms, data structures, performance optimization techniques, object\\-oriented programming, multi\\-threading, and real\\-time programming.
* Experience with distributed caching, SQL/NO SQL, and other databases is a plus.
* Experience with Big Data and cloud services such as AWS/GCP is a plus.
* Experience in advertising domain a big plus
* B.S. or M.S. degree in Computer Science, Engineering, or equivalent
* Self\\-motivated individual with a high level of accountability and ownership.
* Critical thinking and practical decision making.
* Can do, results\\-oriented mindset.
* Nonpolitical, collaborative, and team oriented.
* Desire to win in a highly competitive industry.
* AI growth mindset / AI Literacy


  
 
  
 



  
 


**Benefits** 

 Roku is committed to offering a diverse range of benefits as part of our compensation package to support our employees and their families. Our comprehensive benefits include global access to mental health and financial wellness support and resources. Local benefits include statutory and voluntary benefits which may include healthcare (medical, dental, and vision), life, accident, disability, commuter, and retirement options (401(k)/pension). Our employees can take time off work for vacation and other personal reasons to balance their evolving work and life needs. It's important to note that not every benefit is available in all locations or for every role. For details specific to your location, please consult with your recruiter.
 



  
 


**The Roku Culture** 

 Roku is a great place for people who want to work in a fast\\-paced environment where everyone is focused on the company's success rather than their own. We try to surround ourselves with people who are great at their jobs, who are easy to work with, and who keep their egos in check. We appreciate a sense of humor. We believe a fewer number of very talented folks can do more for less cost than a larger number of less talented teams. We're independent thinkers with big ideas who act boldly, move fast and accomplish extraordinary things through collaboration and trust. In short, at Roku you'll be part of a company that's changing how the world watches TV.
 



 We have a unique culture that we are proud of. We think of ourselves primarily as problem\\-solvers, which itself is a two\\-part idea. We come up with the solution, but the solution isn't real until it is built and delivered to the customer. That penchant for action gives us a pragmatic approach to innovation, one that has served us well since 2002\\.
 



 To learn more about Roku, our global footprint, and how we've grown, visit https://www.weareroku.com/factsheet.
 



 By providing your information, you acknowledge that you want Roku to contact you about job roles, that you have read Roku's Applicant Privacy Notice, and understand that Roku will use your information as described in that notice. If you do not wish to receive any communications from Roku regarding this role or similar roles in the future, you may unsubscribe here at any time.","Software Development","https://www.linkedin.com/company/roku","https://media.licdn.com/dms/image/v2/D560BAQGwtnEFj0grWQ/company-logo_100_100/B56ZaxohrVH0AU-/0/1746736913380/roku_logo?e=2147483647&v=beta&t=rlz3iSQYwGeir-xgrxNGxQJ9v_dNYWJiqDBsqHkr7L8","","","","","","","","","","",""
"li-4341990083","linkedin","https://www.linkedin.com/jobs/view/4341990083","","Software Engineer Intern","Electronic Arts (EA)","Hyderabad, Telangana, India","","temporary","","","","","",False,"internship","Engineering and Information Technology","","","**Description \\& Requirements**
 Electronic Arts creates next\\-level entertainment experiences that inspire players and fans around the world. Here, everyone is part of the story. Part of a community that connects across the globe. A place where creativity thrives, new perspectives are invited, and ideas matter. A team where everyone makes play happen.
   

  

**Software Engineer Intern (Systest Engineer)**
**We are EA**
**Electronic Arts is more than you’ve ever realized. We’re more than a company, or a headline, or even a clever catchphrase – we’re a vibrant community of artists, storytellers, technologists, and innovators working toward a shared vision: to inspire and unite through play.**
**While headquartered in Redwood City, EA's platform engineering, game development, and publishing operations take place in a network of locations, stretching from Shanghai to Stockholm, Melbourne to Vancouver, Redwood City to Hyderabad. No matter which of our locations you join, you’ll feel the energy and support of EA’s global brand, while immersing yourself in a culture that inspires you to thrive, take risks and dream big.**
**This is an especially great time for the video game industry, as we’re currently going through an exciting digital transformation. The global gaming audience has also never been bigger, with industry revenue projected to reach $295\\.6 billion by 2026\\.**
**Since its founding in 1982, EA has helped shape the way over 300 million registered players consume and enjoy interactive media. No other company can deliver EA’s portfolio of amazing games and services, across multiple platforms, to players around the world. It is an exciting era in games, and an exciting time to join the team at EA!**
**The Challenge Ahead**
**The EA Digital Platform (EADP) organization is responsible for driving critical technology decisions and investments for EA on a global basis, across all divisions and studio teams. Technology and engineering leadership at EA is critical to making the industry’s best games and services and the EADP team is leading the way to providing cross\\-platform infrastructure and services that will keep our consumers connected with our games anytime, anywhere with anyone.**
**Responsibilities**
* Build/Integrate tools to automate the process and improve the efficiency
* Create, maintain and improve Game call pattern simulation code in C\\+\\+/Scala to support applications and features
* Perform stress and load testing. This includes coming up with a test design, game play driven scenarios and evaluating actual game logs to come up with an accurate representation of load to generate and setting up complex distributed test environment to run tests and generate load
* Execute tests and provide accurate analysis and reporting of test results
* Analyze and troubleshoot system and network issues relating to performance and test automation processes
* Troubleshooting to find root cause of issues identified during testing –isolate test issues vs system component issues.
* Collaboration with the peers to track and resolve issues
* Communication of test status and results to the team
* Adherence to EA’s policies, NDAs and security guidelines
* Prompt reporting, upfront communication of issues and agility in handling multiple tasks


**Qualifications**
* Pursuing bachelor’s degree in computer science
* Knowledge in programming languages like C\\+\\+/Scala/Python.
* Knowledge of cloud systems like AWS (preferable) / GCP/Azure
* Knowledgeable in the area of scalable platform architecture, end to end systems design and architecture
* Passion and creativity for problem solving
* Familiarity with visualization tools (like Grafana etc.,) and database technologies (MySql, Redis, etc.,)
* Able to work and problem solve independently, to organize workload and priorities, high\\-quality execution, technical innovation/adaptation, and initiative


**About Electronic Arts**
 We’re proud to have an extensive portfolio of games and experiences, locations around the world, and opportunities across EA. We value adaptability, resilience, creativity, and curiosity. From leadership that brings out your potential, to creating space for learning and experimenting, we empower you to do great work and pursue opportunities for growth.
   

  

 We adopt a holistic approach to our benefits programs, emphasizing physical, emotional, financial, career, and community wellness to support a balanced life. Our packages are tailored to meet local needs and may include healthcare coverage, mental well\\-being support, retirement savings, paid time off, family leaves, complimentary games, and more. We nurture environments where our teams can always bring their best to what they do.
   

  

 Electronic Arts is an equal opportunity employer. All employment decisions are made without regard to race, color, national origin, ancestry, sex, gender, gender identity or expression, sexual orientation, age, genetic information, religion, disability, medical condition, pregnancy, marital status, family status, veteran status, or any other characteristic protected by law. We will also consider employment qualified applicants with criminal records in accordance with applicable law. EA also makes workplace accommodations for qualified individuals with disabilities as required by applicable law.","Entertainment Providers","https://www.linkedin.com/company/electronic-arts","https://media.licdn.com/dms/image/v2/D4E0BAQGQxdnYoe0DZQ/company-logo_100_100/B4EZVJmsPmGgAU-/0/1740696634652/electronic_arts_logo?e=2147483647&v=beta&t=aUSc5xUdEi0uvicW_51Yh57I0XlpCbeIdARV5VNrCs8","","","","","","","","","","",""
