"id","site","job_url","job_url_direct","title","company","location","date_posted","job_type","salary_source","interval","min_amount","max_amount","currency","is_remote","job_level","job_function","listing_type","emails","description","company_industry","company_url","company_logo","company_url_direct","company_addresses","company_num_employees","company_revenue","company_description","skills","experience_range","company_rating","company_reviews_count","vacancy_count","work_from_home_type"
"li-4355452007","linkedin","https://www.linkedin.com/jobs/view/4355452007","https://eeho.fa.us2.oraclecloud.com/hcmUI/CandidateExperience/en/job/323882/?utm_medium=jobboard&utm_source=LinkedIn&urlHash=8FmG","Software Developer 2","Oracle","Ahmedabad, Gujarat, India","","fulltime","","","","","",False,"mid-senior level","Engineering and Information Technology","","_mb@oracle.com","**Job Description**
 Design, develop, troubleshoot and debug software programs for databases, applications, tools, networks etc.
   

  

 As a member of the software engineering division, you will assist in defining and developing software for tasks associated with the developing, debugging or designing of software applications or operating systems. Provide technical leadership to other software developers. Specify, design and implement modest changes to existing software architecture to meet changing needs.
   

  

 Duties and tasks are varied and complex needing independent judgment. Fully competent in own area of expertise. May have project lead role and or supervise lower level personnel. BS or MS degree or equivalent experience relevant to functional area. 4 years of software engineering or related experience.
   

  

**Responsibilities**
 As a member of the software engineering division, you will apply basic to intermediate knowledge of software architecture to perform software development tasks associated with developing, debugging or designing software applications or operating systems according to provided design specifications. Build enhancements within an existing software architecture and occasionally suggest improvements to the architecture.
   

  

 Define and maintain architecture roadmap, technical solutions for new and existing functionality for the products.
   

  

 Take ownership over architecture qualities of the end\\-to\\-end distributed applications
   

  

 Deliver architectural services, including guidance and conceptual design as well as technical and process innovations.
   

  

 Oversee the software development processes from start to finish by analyzing requirements, designing system architecture, coordinating with other teams to prioritize and allocate tasks
   

  

 Build high quality software by prioritizing quality control, collaborate with quality assurance team to define test plans and strategies, ensuring that software is thoroughly tested
   

  

 Leading and mentoring the engineering team by providing technical guidance, support and technical expertise to other team members, fostering a collaborative and productive work environment
   

  

 Design complex systems which are scalable and fault tolerant. You will reason about trade\\-offs (timeliness/accuracy/resource usage) of multiple algorithmic solutions and to highlight the difference in product outcomes.
   

  

 Investigate the latest technology and build quick Proof of Concept functionalities to address future business needs.
   

  

 Drive implementation of telemetry features based on the domain requirements to improve the overall operational excellence of the application
   

  

 Drive automation using more adoption and maturity on the CICD stage gates for the applications
   

  

 Ensure coding best practices and industry standards are followed throughout the development lifecycle.
   

  

 Ensure seamless integration and synchronization between various components and modules of the software
   

  

 Ensure projects are delivered on time and within budget by collaborating with stakeholders to define project scope, estimate timelines and identify potential risks and challenges
   

  

**Qualifications**
 Career Level \\- IC2
   

  

**About Us**
 Only Oracle brings together the data, infrastructure, applications, and expertise to power everything from industry innovations to life\\-saving care. And with AI embedded across our products and services, we help customers turn that promise into a better future for all. Discover your potential at a company leading the way in AI and cloud solutions that impact billions of lives.
   

  

 True innovation starts when everyone is empowered to contribute. That’s why we’re committed to growing a workforce that promotes opportunities for all with competitive benefits that support our people with flexible medical, life insurance, and retirement options. We also encourage employees to give back to their communities through our volunteer programs.
   

  

 We’re committed to including people with disabilities at all stages of the employment process. If you require accessibility assistance or accommodation for a disability at any point, let us know by emailing accommodation\\-request\\_mb@oracle.com or by calling 1\\-888\\-404\\-2494 in the United States.
   

  

 Oracle is an Equal Employment Opportunity Employer. All qualified applicants will receive consideration for employment without regard to race, color, religion, sex, national origin, sexual orientation, gender identity, disability and protected veterans’ status, or any other characteristic protected by law. Oracle will consider for employment qualified applicants with arrest and conviction records pursuant to applicable law.","IT Services and IT Consulting","https://www.linkedin.com/company/oracle","https://media.licdn.com/dms/image/v2/D4E0BAQHYCgYovUuPtQ/company-logo_100_100/company-logo_100_100/0/1665755678957/oracle_logo?e=2147483647&v=beta&t=55lZDJhHdt3oPj2_gdPpymKz6Wv_9atXeO-CBFzAm6c","","","","","","","","","","",""
"li-4336690751","linkedin","https://www.linkedin.com/jobs/view/4336690751","https://careers.abb/global/en/job/ABB1GLOBAL95722082EXTERNALENGLOBAL/Software-Engineer?utm_source=linkedin&utm_medium=phenom-feeds&source=LinkedIn&urlHash=I5G6","Software Engineer","ABB","Bengaluru East, Karnataka, India","","fulltime","","","","","",False,"not applicable","Engineering and Information Technology","","","At ABB, we help industries outrun \\- leaner and cleaner. Here, progress is an expectation \\- for you, your team, and the world. As a global market leader, we’ll give you what you need to make it happen. It won’t always be easy, growing takes grit. But at ABB, you’ll never run alone. Run what runs the world.
   

  

 This Position reports to:
   

  

 Digital Solution Engineering Manager
   

  

  

  

**Your role and responsibilities**
 In this role, We are looking for a highly skilled Sr Software Engineer with extensive experience in .NET and React to lead the development of cutting\\-edge software solutions for the Process Automation Industry. In this role, you will drive the technical strategy, define architectural best practices, and mentor engineering teams to build scalable and high\\-performance industrial automation systems. You will collaborate closely with cross functional stakeholders to align technical roadmaps with business objectives, ensuring innovation, reliability, and efficiency in mission\\-critical environments
   

  

 This role is contributing to Process Automation business for Process Automation Digital division based in Bangalore Southfield, India
   

  

 Your responsibilities:
   

  

* Define and implement scalable, high\\-performance software architectures using .NET (C\\#) and React/Redux
* Provide technical direction and mentorship to development teams, ensuring adherence to best coding and design practices.
* Architect and optimize microservices\\-based solutions, ensuring modularity, performance, and maintainability. Drive innovation by identifying and implementing AI\\-powered automation tools for software development and testing.
* Write clean, maintainable, and well\\-documented code, following SOLID principles. Design and develop applications that integrate with industrial automation systems (SCADA, MES, OPC UA, PLCs, IoT platforms).
* Ensure seamless real\\-time data processing and communication between IT and OT systems. Define standards for system reliability, fault tolerance, and high availability in mission\\-critical industrial environments
* Actively participate in Agile (Scrum/Kanban) sprints, ensuring timely delivery of features. Ensure frontend and backend integration through well\\-structured RESTful APIs and WebSocket's


**Qualifications for the role**
 Bachelor's or Master's degree in Computer Science, Engineering, or a related technical field.
   

  

 7\\+ years of extensive experience in .NET and Angular to lead the development of cutting\\-edge software solutions for the Process Automation Industry.
   

  

 Technical Skills:
   

  

* Backend: .NET Core, C\\#, ASP.NET, Web APIs, Entity Framework \\& Frontend: React JS, TypeScript, RxJS, NgRx
* Database: SQL Server, PostgreSQL, or NoSQL databases \\& Cloud \\& DevOps: Azure/AWS, Docker, Kubernetes, CI/CD Pipelines
* Automation \\& Industrial Protocols: OPC UA, MQTT, SCADA, MES \\& Testing \\& Security: Unit testing, security bestpractices, OWASP
* Good knowledge of containerization using K8s / K3s / Docker \\& Experience of working with virtual environments(Vmware / Hyperview / Azure)


**More about us**
 ABB a provides a comprehensive range of integrated automation, electrical and digital systems and services for customers in the process, hybrid and maritime industries. These offerings, coupled with deep domain knowledge in each end market, help to optimize productivity, energy efficiency, sustainability and safety of industrial processes and operations.
   

  

 We value people from different backgrounds. Could this be your story? Apply today or visit www.abb.com to read more about us and learn about the impact of our solutions across the globe.
   

  

**Fraud Warning:** 
 Any genuine offer from ABB will always be preceded by a formal application and interview process.
   

  

 We never ask for money from job applicants.
   

  

 For current open positions you can visit our career website https://global.abb/group/en/careers and apply.
   

  

 Please refer to detailed recruitment fraud caution notice using the link https://global.abb/group/en/careers/how\\-to\\-apply/fraud\\-warning.","Appliances, Electrical, and Electronics Manufacturing","https://ch.linkedin.com/company/abb","https://media.licdn.com/dms/image/v2/C4D0BAQHPGAMgqJMBZQ/company-logo_100_100/company-logo_100_100/0/1630579606103/abb_logo?e=2147483647&v=beta&t=UOAvwz5s6liS099z91BNomM-lOY3CC7ClOAVlUTpdR8","","","","","","","","","","",""
"li-4303948994","linkedin","https://www.linkedin.com/jobs/view/4303948994","","Software Engineer II","Blackhawk Network India","Bengaluru, Karnataka, India","","fulltime","","","","","",False,"entry level","Engineering and Information Technology","","","**About Blackhawk Network:**
 Today, through BHN’s single global platform, businesses of all kinds can tap into the world’s largest network of branded payment solutions. BHN helps businesses grow revenue, increase loyalty, motivate and reward their teams, disburse funds and engage consumers. Branded payment solutions include the issuance and distribution of gift cards, egifts, corporate payouts and rewards, along with the technology to deliver these products in seamless, integrated ways. BHN’s network spans the globe with more than 400,000 consumer touchpoints. Learn more at BHN.com.
   

  

**Overview:**
* Write clean, reusable code that’s easy to read and test.
* Build products that perform, scale, are highly available and fault tolerant with automated failover capabilities.
* Operate and scale a rapidly growing product that is vital to our partners.
* Contribute novel ideas and collaborate with cross\\-functional teams to deliver and improve Blackhawk systems.
* Collaborate with product architects, product owners, and other stakeholders to deliver high value capabilities to the platform.
* Leverage AI tools such as copilot or Claude.ai to improve efficiency.


**Responsibilities:**
* Bachelor or Master’s degree in Computer Science and/or equivalent experience.
* Solid programming Knowledge building distributed systems using java technologies. Expert in Core Java 8 or above.
* Hands\\-on experience in using relational database with good exposure to SQL OR nosql such as MongoDB..
* Strong computational skills, fluent in data structures, algorithms and design patterns.
* Strong knowledge of computing concepts such as service\\-oriented architecture, REST services, fault tolerance, self\\-healing, network protocols, network programming, multi threaded programming, performance, reliability, scalability, and security.
* Ability to differentiate good and bad design and coding practices.
* Strong verbal and written communication skills.
* Strong in self\\-direction, problem solving and critical thinking.
* Deep passion for providing high quality customer experiences.
* Familiarity with the whole web stack, including protocols.


 Preferred:
   

  

* Experience with Amazon Web Services (AWS) including RDS and EC2\\.
* Experience with container\\-based application development using Docker/ Kubernetes.


**Qualifications:**
 Bachelor or Master’s degree in Computer Science and/or equivalent experience.
   

  

 We seek candidates who not only demonstrate curiosity and adaptability in emerging technologies but have also successfully implemented and utilized AI tools to enhance their work, improve processes, or deliver measurable results. Our teams embrace continuous learning and the thoughtful integration of AI to create meaningful impact – for our employees and the future of work.","Financial Services","https://in.linkedin.com/company/blackhawk-network-india","https://media.licdn.com/dms/image/v2/D560BAQEL5EztGwxfvg/company-logo_100_100/company-logo_100_100/0/1718234615232/blackhawk_network_india_logo?e=2147483647&v=beta&t=nGRPnLQGWsVRJJFe3rt-Jhx637krPDTqxI47d26zUmk","","","","","","","","","","",""
"li-4364502923","linkedin","https://www.linkedin.com/jobs/view/4364502923","","Backend Developer","Best Job Tool","","","fulltime","","","","","",False,"associate","Information Technology","","","**About The Company**
 Vetic is a leading technology company dedicated to transforming the healthcare industry through innovative software solutions. Our mission is to improve patient outcomes by developing scalable, reliable, and secure digital platforms that streamline healthcare delivery. With a focus on cutting\\-edge technology and a customer\\-centric approach, Vetic strives to set new standards in healthcare technology, enabling providers and patients to connect seamlessly and efficiently. Our team comprises passionate professionals committed to making a meaningful impact in the healthcare ecosystem through continuous innovation and excellence.
   

  

**About The Role**
 We are seeking a highly skilled and experienced Backend Engineer to join our dynamic team at Vetic. In this role, you will be responsible for designing, developing, and maintaining our core backend systems that support our healthcare applications. You will work closely with cross\\-functional teams including product managers, data scientists, and frontend developers to build scalable and high\\-performance data infrastructure. Your expertise will be instrumental in ensuring our systems are robust, efficient, and capable of handling complex business logic and large data volumes. This position offers an exciting opportunity to influence the technological direction of Vetic and contribute to innovations that directly impact healthcare delivery.
   

  

**Qualifications**
 To be successful in this role, candidates should possess a strong technical background with proven experience in backend development. A deep understanding of Python programming and extensive experience working with data stores such as Postgres, MongoDB, Elastic, and Redis are essential. Candidates should have a track record of designing and implementing scalable, reliable systems that support complex business operations. Experience in debugging, performance optimization, and resolving bottlenecks in production environments is critical. Leadership qualities, including mentoring junior engineers and promoting best practices, are highly valued. Excellent communication skills and a strategic mindset are necessary to align technical initiatives with business objectives. A bachelor’s degree in Computer Science, Software Engineering, or a related field is typically required, along with several years of relevant experience.
   

  

**Responsibilities**
 As a Backend Engineer at Vetic, your key responsibilities will include:
   

  

* Planning, architecting, and building scalable design systems that support vital business workflows. You will investigate and resolve performance issues across our data stack, including Postgres, MongoDB, Elastic, and Redis, ensuring system reliability and speed.
* Guiding and mentoring fellow developers through code reviews, design sessions, and technical deep\\-dives. Your leadership will help foster a culture of excellence and continuous improvement within the engineering team.
* Collaborating with product managers, designers, and other cross\\-functional teams to define engineering priorities that align with our overall business goals and strategic vision.
* Taking end\\-to\\-end ownership of core systems, ensuring they are well\\-documented, resilient, and adaptable to future requirements. You will ensure systems are maintainable and easy to evolve as our needs grow.
* Continuously evaluating emerging technologies, frameworks, and tools to enhance system efficiency, scalability, and security. Your proactive approach will help keep Vetic at the forefront of healthcare technology innovation.


**Benefits**
 Vetic offers a comprehensive benefits package designed to support our employees' health, well\\-being, and professional growth. We provide competitive salary packages, health insurance coverage, and wellness programs. Employees have access to ongoing learning opportunities, including training sessions, workshops, and conferences to enhance their skills. We promote a flexible work environment that encourages work\\-life balance, along with a collaborative and inclusive company culture. Additionally, Vetic is committed to supporting diversity and fostering a workplace where all employees feel valued and empowered to contribute to our mission of transforming healthcare through technology.
   

  

 Equal Opportunity
   

  

 Vetic is an equal opportunity employer. We celebrate diversity and are committed to creating an inclusive environment for all employees. We do not discriminate based on race, religion, gender, sexual orientation, age, disability, or any other protected characteristic. Our hiring decisions are based solely on qualifications, skills, and experience. We believe that diverse teams drive innovation and are essential to our success in delivering impactful healthcare solutions.","Technology, Information and Media","https://in.linkedin.com/company/best-job-tool","https://media.licdn.com/dms/image/v2/D4E0BAQGsT77GQrkFFA/company-logo_100_100/company-logo_100_100/0/1737695564287?e=2147483647&v=beta&t=pYXe5Z5TBfYOqodx0mspJ29V8IHGC5_9aEdw1MPggSA","","","","","","","","","","",""
"li-4364198443","linkedin","https://www.linkedin.com/jobs/view/4364198443","","Staff Engineer, Data Science","Nagarro","","","fulltime","","","","","",False,"mid-senior level","Engineering","","","**Company Description**
**👋🏼** 
**We're Nagarro.**
 We are a Digital Product Engineering company that is scaling in a big way! We build products, services, and experiences that inspire, excite, and delight. We work at scale across all devices and digital mediums, and our people exist everywhere in the world (17500\\+ experts across 39 countries, to be exact). Our work culture is dynamic and non\\-hierarchical. We're looking for great new colleagues. That's where you come in!
   

  

**Job Description**
**REQUIREMENTS:**
* Total experience: 5\\+ Years
* Must have experience in Machine Learning Fundamentals, Data Analysis \\& Visualization, Statistics \\& Probability, SQL, Model Packaging \\& Deployment.
* Must have hands on generative AI fundamental, RAG, text to SQL.
* Should have experience in Python or R for Data Science.
* Should have experience in Classification\\-regression, Forecasting ,Anomaly detection, Market mix model, Predictive analysis, Unsupervised Models, Recommendation Systems, Natural Language processing \\& Optimization.
* Should have experience in Data science on AWS/Azure/GCP.
* Must have exposure in model deployment using docker/Kubernetes.
* Strong troubleshooting skills in different disparate technologies and environments.
* Should be enthusiastic about different areas of work and exploring new technologies.
* Should have clarity of thought and strong communication skills to effectively pitch solutions.
* Must have ability to explore and grasp new technologies.
* Must be capable of mentoring team members in projects and helping them keep up with new technologies.
* Should be empowering the team members to be solution providers and enable a flat environment where everyone’s point of view is considered, and feedback is encouraged.


**RESPONSIBILITIES:**
* Writing and reviewing great quality code
* Understanding the client’s business use cases and technical requirements and be able to convert them into technical design which elegantly meets the requirements.
* Mapping decisions with requirements and be able to translate the same to developers.
* Identifying different solutions and being able to narrow down the best option that meets the client’s requirements.
* Defining guidelines and benchmarks for NFR considerations during project implementation
* Writing and reviewing design document explaining overall architecture, framework, and high\\-level design of the application for the developers
* Reviewing architecture and design on various aspects like extensibility, scalability, security, design patterns, user experience, NFRs, etc., and ensure that all relevant best practices are followed.
* Developing and designing the overall solution for defined functional and non\\-functional requirements; and defining technologies, patterns, and frameworks to materialize it.
* Understanding and relating technology integration scenarios and applying these learnings in projects
* Resolving issues that are raised during code/review, through exhaustive systematic analysis of the root cause, and being able to justify the decision taken.
* Carrying out POCs to make sure that suggested design/technologies meet the requirements.
* Should be open to travel onsite once a month.


**Qualifications**
 Bachelor’s or master’s degree in computer science, Information Technology, or a related field.","IT Services and IT Consulting","https://de.linkedin.com/company/nagarro","https://media.licdn.com/dms/image/v2/D4D0BAQHu-RIXbSi0fw/company-logo_100_100/company-logo_100_100/0/1688362226392/nagarro_logo?e=2147483647&v=beta&t=UfpX2jt95as2GeMzFnOXw90x9x816A-lFoVN9nw5kTM","","","","","","","","","","",""
"li-4364198502","linkedin","https://www.linkedin.com/jobs/view/4364198502","","QA Engineer – AI Engineering","Agivant Technologies","Pune, Maharashtra, India","","fulltime","","","","","",False,"mid-senior level","Information Technology","","","**Overview:**
 We are looking for a QA Engineer with 2–6 years of experience in software testing, with a focus on validating AI/ML models, data pipelines, and AI\\-driven applications. The ideal candidate should have strong automation skills, good understanding of ML workflows, and experience testing AI systems.
   

  

**Key Responsibilities:**
 Test AI/ML models for accuracy, consistency, fairness, drift, and quality.
   

  

 Validate datasets, data pipelines, and model outputs.
   

  

 Create and execute automated test scripts (Python preferred) for APIs, UI, and model inference.
   

  

 Perform performance and reliability testing of AI services (latency, throughput, scalability).
   

  

 Identify defects, report issues, and drive quality improvements.
   

  

 Work with ML engineers, data scientists, and product teams to understand requirements and define test scenarios.
   

  

 Maintain test plans, cases, and documentation.
   

  

**Requirements**
**Skills \\& Qualifications:**
 2–6 years of QA/testing experience.
   

  

 Hands\\-on experience with Python, automated testing, and QA tools (PyTest, Postman, Robot Framework, etc.).
   

  

 Basic understanding of ML models, LLMs, NLP/CV systems, and evaluation metrics.
   

  

 Experience in API testing and CI/CD integration.
   

  

 Strong analytical, communication, and problem\\-solving skills.
   

  

**Good\\-to\\-Have:**
 Experience with MLflow, Airflow, MLOps tools.
   

  

 Knowledge of LLM testing frameworks (Evals, Ragas, LangSmith).
   

  

 Exposure to vector databases or cloud platforms.","IT Services and IT Consulting","https://www.linkedin.com/company/agivanttech","https://media.licdn.com/dms/image/v2/C560BAQHQEq02G6X9NA/company-logo_100_100/company-logo_100_100/0/1679265540472?e=2147483647&v=beta&t=_7D_T1kX7G9DYE7k1dI_FqHoqse5WKW5DeA15EKoFCs","","","","","","","","","","",""
