"id","site","job_url","job_url_direct","title","company","location","date_posted","job_type","salary_source","interval","min_amount","max_amount","currency","is_remote","job_level","job_function","listing_type","emails","description","company_industry","company_url","company_logo","company_url_direct","company_addresses","company_num_employees","company_revenue","company_description","skills","experience_range","company_rating","company_reviews_count","vacancy_count","work_from_home_type"
"li-4223708421","linkedin","https://www.linkedin.com/jobs/view/4223708421","https://fractal.wd1.myworkdayjobs.com/Careers/job/Bengaluru/Fullstack-Engineer\\u002d\\u002dReBoot-_SR-31895?source=LinkedIn&urlHash=_hQm","Fullstack Engineer (ReBoot)","Fractal","Bengaluru, Karnataka, India","","fulltime","","","","","",False,"mid-senior level","Engineering and Information Technology","","","It's fun to work in a company where people truly BELIEVE in what they are doing!
   

  

*We're committed to bringing passion and customer focus to the business.*
 It's fun to work in a company where people truly BELIEVE in what they are doing!
   

  

 We're committed to bringing passion and customer focus to the business.
   

  

 ReBoot is Fractal’s returnship program that is designed to reintegrate people who are rejoining the workforce after a career hiatus of a year of more. ReBoot helps re\\-joiners reintegrate seamlessly back into the workforce with inclusions like stipends, blended training, immersive experiences, community building and paths to full\\-time positions.
   

  

 Eligibility: 3\\-8 years of relevant work experience with a minimum Gap of 1 year and not more than 4 years
   

  

 Fullstack React Python Engineer
   

  

 Job Location: BLR/MUM/GUR/PUNE/CHENNAI/HYD/NOIDA/COIMBATORE
   

  

 Grade: 8/7
   

  

**About Fractal**
 Fractal is a leading AI \\& analytics organization. We have a strong Fullstack Team with great leaders accelerating the growth. Our people enjoy a collaborative work environment, exceptional training, and career development as well as unlimited growth opportunities. We have a Glassdoor rating of 4/5 and achieve customer NPS of 9/10\\. If you like working with a curious, supportive, high\\-performing team, Fractal is the place for you.
   

  

**Job Description**
 As a Fullstack (React and Python) Engineer, you would be part of the team consisting of Scrum Master, Cloud Engineers, AI/ML Engineers, and UI/UX Engineers to build end\\-to\\-end Data to Decision Systems.
   

  

 You would report to a Senior Fullstack Engineer and your responsibility would be as below\\-
   

  

 Managing, developing \\& maintaining the backend and frontend for various Data to Decision projects for our Fortune 500 client.
   

  

 Work closely with the data science \\& engineering team to integrate the algorithmic output from the backend REST APIs.
   

  

 Work closely with business and product owners to create dynamic infographics with intuitive user controls .
   

  

 Participate in UAT, and diagnose \\& troubleshoot, bugs and application integration issues.
   

  

 Create and maintain documentation related to the developed processes and applications.
   

  

 Qualification
   

  

 3 to 8 years of demonstrable experience designing, building, and working as a Fullstack Engineer for enterprise web applications.
   

  

 Expert\\-level proficiency with JavaScript (ES6\\), ReactJS,HTML5 \\& CSS
   

  

 Expert\\-level proficiency with Python (3\\.4\\+), Django (2\\.1\\+) or Flask Or Java
   

  

 Familiarity with common databases (RDBMS such as MySQL \\& NoSQL such as MongoDB) and data warehousing concepts (OLAP, OLTP)
   

  

 Understanding of REST concepts and building/interacting with REST APIs
   

  

 Deep understanding of a few UI concepts: Cross\\-browser compatibility and implementing responsive web design
   

  

 Hands\\-on experience with test driven development, using testing libraries like Jest, PyTest and Nose
   

  

 Develop and design RESTful services and APIs
   

  

 Develop functional databases, applications, and servers to support websites on the back end
   

  

 Performance optimization and multithreading concepts
   

  

 Education
   

  

 B.E/B.Tech/M.Tech in Computer Science or related technical degree OR Equivalent
   

  

 If you like wild growth and working with happy, enthusiastic over\\-achievers, you'll enjoy your career with us!
   

  

 Not the right fit? Let us know you're interested in a future opportunity by clicking Introduce Yourself in the top\\-right corner of the page or create an account to set up email alerts as new job postings become available that meet your interest!
   

  

 If you like wild growth and working with happy, enthusiastic over\\-achievers, you'll enjoy your career with us!
   

  

 Not the right fit? Let us know you're interested in a future opportunity by clicking
 *Introduce Yourself* 
 in the top\\-right corner of the page or create an account to set up email alerts as new job postings become available that meet your interest!","Business Consulting and Services","https://www.linkedin.com/company/fractal-analytics","https://media.licdn.com/dms/image/v2/D4D0BAQFfWiLKapr2dg/company-logo_100_100/company-logo_100_100/0/1739206750155/fractal_analytics_logo?e=2147483647&v=beta&t=u3TAvymPT_vd6sLm-gjz1eKA_fda94JsF73pXnSd9nU","","","","","","","","","","",""
"li-4289782272","linkedin","https://www.linkedin.com/jobs/view/4289782272","http://careers.cyient.com/#!/job-view/software-engineer-bengaluru-india-2025050610004228/?source=linkedin&urlHash=JuID","Software Engineer","Cyient","Bengaluru, Karnataka, India","","fulltime","","","","","",False,"mid-senior level","Engineering and Information Technology","","","Design, develop, test, and deploy Java\\-based web applications using modern frameworks and technologies.
   

  

 Develop and maintain RESTful APIs and web services.
   

  

 Work with front\\-end developers to integrate UI components with server\\-side logic.
   

  

 Write clean, maintainable, and efficient code following coding standards and best practices.
   

  

 Participate in code reviews, design discussions, and agile development cycles.
   

  

 Troubleshoot, debug, and optimize application performance and scalability.
   

  

 Maintain technical documentation for developed features and modules.
   

  

 Collaborate with QA, DevOps, and other cross\\-functional teams to deliver high\\-quality software.
   

  

 Required Skills \\& Qualifications:
   

  

 Bachelor’s degree in Computer Science, IT, or related field.
   

  

 3 to 4 years of professional experience in Java and Web Application Development.
   

  

 Strong knowledge of Spring / Spring Boot, JPA/Hibernate, and RESTful services.
   

  

 Experience with HTML, CSS, JavaScript, and front\\-end frameworks like Angular, React, or Vue.js.
   

  

 Familiarity with SQL and relational databases such as MySQL, PostgreSQL, or Oracle.
   

  

 Understanding of software development best practices, including unit testing, version control (Git), and CI/CD.","Engineering Services","https://in.linkedin.com/company/cyient","https://media.licdn.com/dms/image/v2/C560BAQH1R4D7WxP_LA/company-logo_100_100/company-logo_100_100/0/1630646440615/cyient_logo?e=2147483647&v=beta&t=OPmWp2B6xRcM9IczR2txhdCvlxS4ZVRx2ihrpwxhGRg","","","","","","","","","","",""
"li-4278976905","linkedin","https://www.linkedin.com/jobs/view/4278976905","","SQL Developer","PrismHR","Noida, Uttar Pradesh, India","","fulltime","","","","","",False,"mid-senior level","Information Technology","","taglobal@prismhr.com","We're seeking a SQL Developer to augment its backend processing, reporting and analytics capabilities. The ideal candidate needs to have practical exposure to backend design and optimization techniques, and able to use that knowledge to solve complex problems. The role requires a proactive and self motivated individual, who is willing to take an idea, groom it into a well defined user story, and see through the implementation.
   

  

**Responsibilities**
* Experience in analyzing and debugging execution plans.
* Experience in creating and managing indexs based on development cycles.
* Strong development experience, preferably on web based applications, however a mix of desktop and web based applications is also acceptable.
* Strong hands on skills on SQL Server 2012/2016/2019, including use of analyzing and debugging tools, query optimization, transaction handling, stored procedures, functions, triggers and views.
* Experience in designing and implementing highly optimized queries for consistent response time, under a highly variable and fluctuating processing load.
* Experience in converting raw data into usable formats, for reporting and business analytics.
* Exposure and practical experience on SQL Server Reporting Services will be an considered an advantage.
* Exposure to at least one NoSQL database such as Cosmos DB will be considered an advantage.
* Exposure to applications hosted on one of the leading cloud hosting platforms (Microsoft Azure, Amazon AWS, Google Cloud), and having practical ideas towards designing solutions to minimize resource usage.


**Qualifications**
* B.Tech./B.E./ M.Tech./BCA/MCA with first class (\\>60%) throughout in academics, from reputed institutions.
* Familiarity with at least one or more source control tools like Github, or Subversion (SVN).
* Exposure and practical working experience on Agile methodology.
* The job requires some overlapping with the US based teams, so the candidate should be flexible to work in afternoon shift 1PM to 10PM IST.


 PrismHR is a fast\\-paced SaaS company which provides customers with a cloud\\-based payroll process software application. PrismHR also provides professional services including system implementation consulting, custom configurations, and training. Lastly, via the Company’s Marketplace platform customers and end users access other human resources and employee benefits applications from PrismHR’s Marketplace Partners.
   

  

**Diversity, Equity And Inclusion Program/Affirmative Action Plan**
 We have transformed our company into an inclusive environment where individuals are valued for their talents and empowered to reach their fullest potential. At PrismHR, we strive to continually lead with our values and beliefs that enable our employees to develop their potential, bring their full self to work, and engage in a world of inclusion.
   

  

 Ensuring an inclusive environment for our employees is an integral part of the PrismHR culture. We aren't just checking a box, we are truly committed to creating a workplace that celebrates the diversity of our employees and fosters a sense of belonging for everyone. This is essential to our success. We are dedicated to building a diverse, inclusive, and authentic workplace, so if you’re excited about our roles but your past experience doesn’t align perfectly with every qualification in the job description, we encourage you to apply anyway. You may be just the right candidate for these open roles or other open roles. We particularly encourage applicants from traditionally under\\-represented groups as we seek to increase the diversity of our workforce and provide fair opportunities for all.
   

  

 As a proud Equal Opportunity and Affirmative Action Employer, PrismHR encourages talent from all backgrounds to join our team. Employment decisions are based on an individual’s qualifications as they relate to the job under consideration. The Company’s policy prohibits unlawful discrimination based on sex (which includes pregnancy, childbirth, breastfeeding, or related medical conditions, the actual sex of the individual, or the gender identity or gender expression), race, color, religion, including religious dress practices and religious grooming practices, sexual orientation, national origin, ancestry, citizenship, marital status, familial status, age, physical disability, mental disability, medical condition, genetic information, protected veteran or military status, or any other consideration made unlawful by federal, state or local laws, ordinances, or regulations.
   

  

 The Company is committed to complying with all applicable laws providing equal employment opportunities. This commitment applies to all persons involved in the operations of the Company and prohibits unlawful discrimination by any employee of the Company, including supervisors and co\\-workers.
   

  

 Privacy Policy: For information about how we collect and use your personal information, please see our privacy statement available at https://www.prismhr.com/about/privacy\\-policy.
   

  

*PrismHR provides reasonable accommodation for qualified individuals with disabilities and disabled veterans in job application procedures. If you have any difficulty using our online system and you need a reasonable accommodation due to a disability, you may use the following alternative email address to contact us about your interest in employment at PrismHR: taglobal@prismhr.com. Please indicate in the subject line of your email that you are requesting accommodation. Only candidates being considered for a position who require an accommodation will receive a follow\\-up response.*","IT Services and IT Consulting, Software Development, and Human Resources Services","https://www.linkedin.com/company/prismhr","https://media.licdn.com/dms/image/v2/D560BAQHMC-eIlwcDmw/company-logo_100_100/company-logo_100_100/0/1727815226901/prismhr_logo?e=2147483647&v=beta&t=5O0UroShTD_QC3juKIHrjbKUbsZGd8JP4skP_o3BmZI","","","","","","","","","","",""
"li-4310660804","linkedin","https://www.linkedin.com/jobs/view/4310660804","","Software Engineer 2","Microsoft","Hyderabad, Telangana, India","","fulltime","","","","","",False,"not applicable","Engineering and Information Technology","","","The AI Platform organization at Microsoft builds the end\\-to\\-end Azure AI stack/PaaS and is core to Azure’s innovation and differentiation, as well as all of Microsoft’s flagship products, from Office to Teams, to Xbox. We are the team building Azure OpenAI, Azure ML, Cognitive Services, and the global Azure AI infrastructure for running the largest AI workloads on the planet.
   

  

 Within AI Platform, the AI Foundry team enables data scientists and developers to quickly and easily build, train, deploy, manage, and consume machine learning model. Our AI Foundry OSS Model Customization Team is at the forefront of this mission, working on groundbreaking projects for customizing of OSS models. We collaborate closely with research institutions, industry leaders, and organizations worldwide to create innovative solutions that impact millions of users
   

  

**Responsibilities**
**Responsibilities**
 As a Software Engineer 2 in our team, you will:
   

  

* Write clean and concise code with unit tests
* As a contributor in a customer\\-obsessed team, you will collaborate with data scientists and other developers on the team to create the necessary abstractions, infrastructure, interfaces and implement features to train, test, validate for machine learning algorithms including but not limited to data cleaning, model training, hyper parameter tuning at massive, distributed scale. You will also be working on scaling these features for big data using distributed systems. You will drive the incorporation of these customer\\-inspired innovations into our software. You will take holistic ownership of your features.
* Your responsibilities will include contributing to and/or backend stateful services written in C\\# hosted on Kubernetes clusters and Docker containers to provide meaningful features to the customers. You will also be working on improving Python SDK's existing features, designing new features, implementing them in our distributed, multi\\-component SDK, and owning the full lifecycle of the features including testing and release.


**Qualifications**
**Qualifications:**
* 4\\+ years of experience writing production code in building internet scale services and distributed systems.  Ability to debug, read code and work on a large and increasing codebase.
* Engineering knowledge of machine learning systems and data pipelines.
* Experience mentoring other developers, working partners and being a team player.
* Excellent communication and presentation skills


 \\#AzureAIPlatform, \\#AzureAIFoundry,
   

  

 Ability to meet Microsoft, customer and/or government security screening requirements are required for this role. These requirements include but are not limited to the following specialized security screenings: Microsoft Cloud Background Check: This position will be required to pass the Microsoft Cloud background check upon hire/transfer and every two years thereafter.
   

  

 Microsoft is an equal opportunity employer. Consistent with applicable law, all qualified applicants will receive consideration for employment without regard to age, ancestry, citizenship, color, family or medical care leave, gender identity or expression, genetic information, immigration status, marital status, medical condition, national origin, physical or mental disability, political affiliation, protected veteran or military status, race, ethnicity, religion, sex (including pregnancy), sexual orientation, or any other characteristic protected by applicable local laws, regulations and ordinances. If you need assistance and/or a reasonable accommodation due to a disability during the application process, read more about requesting accommodations.","Software Development","https://www.linkedin.com/company/microsoft","https://media.licdn.com/dms/image/v2/D560BAQH32RJQCl3dDQ/company-logo_100_100/B56ZYQ0mrGGoAU-/0/1744038948046/microsoft_logo?e=2147483647&v=beta&t=rr_7_bFRKp6umQxIHErPOZHtR8dMPIYeTjlKFdotJBY","","","","","","","","","","",""
"li-4265094829","linkedin","https://www.linkedin.com/jobs/view/4265094829","","Junior Software Developer | C++","CLO Virtual Fashion","Bengaluru, Karnataka, India","","fulltime","","","","","",False,"entry level","Engineering and Information Technology","","","CLO Virtual Fashion is the creator of CLO and Marvelous Designer, the top 3D garment design programs used in fashion, film, and game development.
   

  

 With over two decades of research and development in accurate garment simulation, CLO Virtual Fashion's mission is to empower users at every step of the garment journey, from concept to design, manufacturing to marketing, and fitting to styling. In addition to 3D garment design software, CLO Virtual Fashion's products include CLO\\-SET (a digital asset management and collaboration platform), CONNECT (a digital fashion hub and marketplace), and consumer\\-facing solutions such as e\\-commerce virtual fittings.
   

  

 Founded in 2009, CLO's interconnected and ever\\-growing product ecosystem is built to power the future of everything related to garments.
   

  

 CLO Virtual Fashion currently has 14 offices located in 12 countries across North America, Asia, Europe, and South America, and continues to expand to serve users around the globe.
   

  

**\\[Position Overview]**
 As a Software Engineer, you will help build a software product plugin that connects different enterprise systems for the Fashion Industry.
   

  

 The work is fast\\-paced and demanding and provides unparalleled exposure to unique opportunities. Our focus is on helping clients extract value from software solutions, not just on making the technology work.
   

  

 In a collaborative, progressive environment, you will work directly with senior management, existing and potential customers, and technical teams. The developer's role spans the software development lifecycle, including early assessment, implementation planning, solution technical design, solution confirmation \\& development, testing, data migration, and post\\-go\\-live support.
   

  

**MAIN RESPONSIBILITIES:**
* Design, architect and develop solutions by collaborating with stakeholders to deliver a high performance software solutions.
* Define and evolve high level architecture, roadmap strategies and implement best practices for the Software product suites.
* Responsible for working independently to develop high\\-quality software products on time and on budget that are aligned with customer business requirements.
* Lead Integration projects for fashion brands to implement a custom GUI, integrate different enterprise systems, and include forecasting challenges to keep all stakeholders informed.
* Responsible for developing a framework, custom UIs using Qt Widgets on existing 3D Fashion Design Software, and C\\+\\+ programming \\& Rest APIs to develop connector plugins for two\\-directional data flow between two softwares.
* As a senior software engineer, the candidate should be able to independently manage internal and external projects with project schedule, delivery, quality checks, managing Issues and risks, monitoring progress, and Reporting and documentation.
* Responsible for supporting the integration projects using various technologies, C\\+\\+, Qt, OOPS, and Rest Web Services.
* Responsible for mentoring team members and software trainees with the assignment of tasks, mentoring, supervision, training, guidance to adopt best practices in development.


**Requirements \\& Skills**
* 2\\-5 years of overall technical experience working with various industry clients in delivering complex programs with Solution Design \\& Implementations.
* Proven experience in designing, implementing web based and/or desktop based software solutions.
* Strong C\\+\\+ programming skills \\& Qt based C\\+\\+ experience. (Object Oriented Programming concepts and design patterns) with 2\\+ years' experience.
* Strong experience building stand\\-alone applications with Qt Framework and Qt Widgets using Qt Creator IDE, with 2\\+ years' experience.
* Experience in integrating various systems using Rest Web Services is a plus.
* Candidate should have worked on a minimum of 2\\-3 projects on C\\+\\+ and Qt and must have performed the role of an solution architect in these projects.
* Candidate should have good analytical and logical thinking. A good team player.
* Excellent written, verbal, presentation, and interpersonal communication skills. Self\\-start is a must.
* Effective organization and time management skills, with the ability to deliver quality software modules and adhere to project deadlines. Also willing to learn new technologies and cross\\-functional programming.
* A candidate is open to working in a startup culture with managing multiple tasks at the same time.
* Degree in Bachelor of Engineering and Master of Engineering.","IT Services and IT Consulting","https://kr.linkedin.com/company/clovirtualfashion","https://media.licdn.com/dms/image/v2/C4D0BAQEx4SfiQvXB1w/company-logo_100_100/company-logo_100_100/0/1630522834062/clo_virtual_fashion_inc__logo?e=2147483647&v=beta&t=nsSpqLXyPxiBrt4HNykNxwaYoVJZKPWGaC_DGjfe310","","","","","","","","","","",""
