"id","site","job_url","job_url_direct","title","company","location","date_posted","job_type","salary_source","interval","min_amount","max_amount","currency","is_remote","job_level","job_function","listing_type","emails","description","company_industry","company_url","company_logo","company_url_direct","company_addresses","company_num_employees","company_revenue","company_description","skills","experience_range","company_rating","company_reviews_count","vacancy_count","work_from_home_type"
"li-4349138668","linkedin","https://www.linkedin.com/jobs/view/4349138668","","React","Virtusa","Chennai, Tamil Nadu, India","","fulltime","","","","","",False,"associate","Other","","","Responsibilities Design Development and Testing Required Skills Relevant experience in Apps Development or systems analysis role Experience with REST SOAP Microservices Core Java ?Experience with Spring Boot Swagger Tomcat and JSON Very hands on role and associate should be able to write code on daily basis Good knowledge of SQL Experience with Kubernetes and Docker Knowledge of Threading Collections Exception Handling JDBC Java OOD OOP Concepts GoF Design Patterns Able to work with Continuous Integration and Continuous Deployment tools Ability to adjust priorities quickly as circumstances dictate Demonstrated problem solving and decision making skills Consistently demonstrates clear and concise written and verbal communication Ability to work under pressure and manage deadlines or unexpected changes in expectations or requirements Nice to have skills Jenkins RLM","IT Services and IT Consulting","https://www.linkedin.com/company/virtusa","https://media.licdn.com/dms/image/v2/D4D0BAQE1wyZ0gd_P_w/company-logo_100_100/B4DZmf03PuJMAY-/0/1759323061531/virtusa_logo?e=2147483647&v=beta&t=BX2oukfWW-ynMINuDRbCIlfgg5xRn0BoZf9Mk-TS1t4","","","","","","","","","","",""
"li-4343050398","linkedin","https://www.linkedin.com/jobs/view/4343050398","https://grnh.se/ksia9t1i1us?gh_src=7c8c68a71us&urlHash=DvyR","Software Engineer","Roku","Bengaluru, Karnataka, India","","fulltime","","","","","",True,"mid-senior level","Engineering and Information Technology","","EmployeeRelations@Roku.com, WorkforcePrivacy@Roku.com","Teamwork makes the stream work.
 
  
 


**Roku is changing how the world watches TV** 

 Roku is the \\#1 TV streaming platform in the U.S., Canada, and Mexico, and we've set our sights on powering every television in the world. Roku pioneered streaming to the TV. Our mission is to be the TV streaming platform that connects the entire TV ecosystem. We connect consumers to the content they love, enable content publishers to build and monetize large audiences, and provide advertisers unique capabilities to engage consumers.
 



 From your first day at Roku, you'll make a valuable \\- and valued \\- contribution. We're a fast\\-growing public company where no one is a bystander. We offer you the opportunity to delight millions of TV streamers around the world while gaining meaningful experience across a variety of disciplines.
 



  
 



**About the role** 




  As a Backend Software Engineer, you’ll design, build, and maintain scalable, high\\-performance services that power our products. You’ll work closely with data, ML engineers, and infrastructure teams to develop APIs, optimize system performance, and ensure reliability across distributed systems. The ideal candidate is passionate about clean architecture, efficient data processing, and delivering high\\-quality code in a collaborative environment.
 



**What you will be doing** 



* Engage with stakeholders, product managers to understand their needs, assess application features and design the solution to solve business problems.
* Lead efforts to evaluate new technologies and continue to push for best practices across the entire development life cycle, including code and design reviews.
* Collaboration with cross\\-functional teams: Partner with product managers, data scientists, and other engineers to deliver impactful solutions


 We are excited if you have 
 * 5\\+ years of experience building large\\-scale distributed systems
* 5\\+ years working with cloud\\-based platforms and infrastructure
* Deep experience in building microservices using Java for container platforms such as Docker or Kubernetes
* Solid understanding of databases SQL and NoSQL
* Hands\\-on Experience working with AWS, GCP or similar cloud services
* Experience with a breadth of protocols and data formats such as REST, WebSockets, HTTPS, JSON, and Protobuf
* Demonstrated ability to drive timely consensus in design with other senior team members
* Bachelors or Master's degree in Computer Science, Engineering, or equivalent.



  
 



  
 



  
 


**Our Hybrid Work Approach** 

 Roku fosters an inclusive and collaborative environment where teams work in the office Monday through Thursday. Fridays are flexible for remote work except for employees whose roles are required to be in the office five days a week or employees who are in offices with a five day in office policy.
 



  
 


**Benefits** 

 Roku is committed to offering a diverse range of benefits as part of our compensation package to support our employees and their families. Our comprehensive benefits include global access to mental health and financial wellness support and resources. Local benefits include statutory and voluntary benefits which may include healthcare (medical, dental, and vision), life, accident, disability, commuter, and retirement options (401(k)/pension). Our employees can take time off work for vacation and other personal reasons to balance their evolving work and life needs. It's important to note that not every benefit is available in all locations or for every role. For details specific to your location, please consult with your recruiter.
 



  
 


**Accommodations** 

 Roku welcomes applicants of all backgrounds and provides reasonable accommodations and adjustments in accordance with applicable law. If you require reasonable accommodation at any point in the hiring process, please direct your inquiries to EmployeeRelations@Roku.com.
 



  
 


**The Roku Culture** 

 Roku is a great place for people who want to work in a fast\\-paced environment where everyone is focused on the company's success rather than their own. We try to surround ourselves with people who are great at their jobs, who are easy to work with, and who keep their egos in check. We appreciate a sense of humor. We believe a fewer number of very talented folks can do more for less cost than a larger number of less talented teams. We're independent thinkers with big ideas who act boldly, move fast and accomplish extraordinary things through collaboration and trust. In short, at Roku you'll be part of a company that's changing how the world watches TV.
 



 We have a unique culture that we are proud of. We think of ourselves primarily as problem\\-solvers, which itself is a two\\-part idea. We come up with the solution, but the solution isn't real until it is built and delivered to the customer. That penchant for action gives us a pragmatic approach to innovation, one that has served us well since 2002\\.
 



 To learn more about Roku, our global footprint, and how we've grown, visit https://www.weareroku.com/factsheet.
 



 By providing your information, you acknowledge that you want Roku to contact you about job roles, that you have read Roku's Applicant Privacy Notice, and understand that Roku will use your information as described in that notice. If you do not wish to receive any communications from Roku regarding this role or similar roles in the future, you may unsubscribe at any time by emailing WorkforcePrivacy@Roku.com.","Software Development","https://www.linkedin.com/company/roku","https://media.licdn.com/dms/image/v2/D560BAQGwtnEFj0grWQ/company-logo_100_100/B56ZaxohrVH0AU-/0/1746736913380/roku_logo?e=2147483647&v=beta&t=rlz3iSQYwGeir-xgrxNGxQJ9v_dNYWJiqDBsqHkr7L8","","","","","","","","","","",""
"li-4340929554","linkedin","https://www.linkedin.com/jobs/view/4340929554","","Software Developer 3","Oracle","Chennai, Tamil Nadu, India","","fulltime","","","","","",False,"mid-senior level","Engineering and Information Technology","","_mb@oracle.com","**Job Description**
 At Oracle Cloud Infrastructure (OCI), we build the future of the cloud for Enterprises as a diverse team of creators and inventors. We act with the speed and attitude of a start\\-up, with the scale and customer\\-focus of the top tier enterprise software company in the world.
   

  

 Values are OCI’s foundation and how we deliver excellence. We strive for equity, inclusion, and respect for all. We are committed to the greater good in our products and our actions. We are constantly learning and taking opportunities to grow our careers and ourselves. We challenge each other to stretch beyond our past to build our future.
   

  

 OCI DevOps services are a customer\\-facing suite of services providing CI/CD functionality to OCI customers. Our roadmap includes delivering a DevOps platform that meets enterprise\\-grade security and compliance requirements. Additionally, we are planning to optimize the existing features to reduce costs and enhance performance.
   

  

 You are the builder here! You will be part of a team of really smart, motivated, and a diverse group of people and given the autonomy and support to do your best work. It is a dynamic and flexible workplace where you’ll belong and be encouraged.
   

  

 Are you interested in building large\\-scale distributed infrastructure systems for the cloud? The OCI team is building new technologies that operate at high scale in a broadly distributed, multi\\-tenant cloud environment. Our customers depend on our work to run their businesses and our mission is to provide them with the best in class set of cloud\\-based services.
   

  

**Responsibilities**
 We are looking for hands\\-on, distributed systems engineers and architects with expertise and passion in solving difficult problems within large scale, global platforms. If this is you, at Oracle you can design and build innovative new systems from the ground up. This is an exciting time in our journey \\- we are growing fast, still at an early stage, and working on ambitious new initiatives. An engineer at any level can have significant technical and business impact.
   

  

 The ideal candidate will have proven experience designing, building, and implementing distributed, cloud\\-scale systems. You should be both a rock\\-solid coder and a distributed systems generalist that is comfortable diving deep into any part of the stack, including interaction with hardware. You should value simplicity and scale, work comfortably in a collaborative, agile environment, and be excited to learn.
   

  

 Minimum Qualifications:
   

  

 Bachelor’s degree in Computer Science or equivalent proven experience
   

  

 3\\+ years' experience building and operating large scale, highly available, cloud based distributed systems
   

  

 Specialist skill in a modern programming language such as Java, C, C\\+\\+, C\\#, Go, or Python, with proficiency in additional languages preferred
   

  

 Validated understanding of operating system fundamentals
   

  

 Strong understanding of data models and distributed persistence technologies
   

  

 Thorough understanding of the latest security principles, techniques, and protocols
   

  

 Strong troubleshooting and performance tuning skills
   

  

 Proficiency in network, distributed, asynchronous, and concurrent programming
   

  

 Knowledge of professional software engineering standard methodologies for the full software development process
   

  

 Experience building and operating scalable infrastructure software or distributed systems
   

  

 Experience using Amazon Web Services such as EC2, EBS, Lambda, Dynamo and S3 or equivalents
   

  

 Proven track record to achieve stretch goals in a highly innovative and fast\\-paced environment
   

  

 Passion for technical leadership and mentoring
   

  

 Strong verbal and written communication skills
   

  

**Preferred Qualifications**
 Strong analytical skills, with excellent problem solving abilities
   

  

 Experience in Agile/SCRUM enterprise\\-scale software development
   

  

 Experience with big data solutions
   

  

 Direct experience with fleet orchestration for both virtual and containerized workloads
   

  

 Knowledge of Machine Learning fundamentals
   

  

 Working familiarity with networking protocols (TCP/IP, HTTP) and standard network architectures
   

  

 Working familiarity with storage principles, protocols and practices
   

  

 Working familiarity with building secure software using modern security principles
   

  

 Life at Oracle:
   

  

 We will ensure that individuals with disabilities are provided reasonable accommodation to participate in the job application or interview process, to perform crucial job functions, and to receive other benefits and privileges of employment. Please contact us to request accommodation.
   

  

 Oracle is an Equal Employment Opportunity Employer. All qualified applicants will receive consideration for employment without regard to race, color, religion, sex, national origin, sexual orientation, gender identity, disability and protected veteran’s status or any other characteristic protected by law.
   

  

 At Oracle, we don’t just value differences—we celebrate them! We’re committed to creating a workplace where all kinds of people work together. We believe innovation starts with diversity and inclusion.
   

  

**Qualifications**
 Career Level \\- IC3
   

  

**About Us**
 As a world leader in cloud solutions, Oracle uses tomorrow’s technology to tackle today’s challenges. We’ve partnered with industry\\-leaders in almost every sector—and continue to thrive after 40\\+ years of change by operating with integrity.
   

  

 We know that true innovation starts when everyone is empowered to contribute. That’s why we’re committed to growing an inclusive workforce that promotes opportunities for all.
   

  

 Oracle careers open the door to global opportunities where work\\-life balance flourishes. We offer competitive benefits based on parity and consistency and support our people with flexible medical, life insurance, and retirement options. We also encourage employees to give back to their communities through our volunteer programs.
   

  

 We’re committed to including people with disabilities at all stages of the employment process. If you require accessibility assistance or accommodation for a disability at any point, let us know by emailing accommodation\\-request\\_mb@oracle.com or by calling \\+1 888 404 2494 in the United States.
   

  

 Oracle is an Equal Employment Opportunity Employer. All qualified applicants will receive consideration for employment without regard to race, color, religion, sex, national origin, sexual orientation, gender identity, disability and protected veterans’ status, or any other characteristic protected by law. Oracle will consider for employment qualified applicants with arrest and conviction records pursuant to applicable law.","IT Services and IT Consulting","https://www.linkedin.com/company/oracle","https://media.licdn.com/dms/image/v2/D4E0BAQHYCgYovUuPtQ/company-logo_100_100/company-logo_100_100/0/1665755678957/oracle_logo?e=2147483647&v=beta&t=55lZDJhHdt3oPj2_gdPpymKz6Wv_9atXeO-CBFzAm6c","","","","","","","","","","",""
"li-4349620171","linkedin","https://www.linkedin.com/jobs/view/4349620171","","Application Developer-ReactJS","IBM","Bengaluru East, Karnataka, India","","fulltime","","","","","",False,"mid-senior level","Engineering and Information Technology","","","**Introduction**
* Strong computer science fundamentals including data structures, algorithms, and design patterns.
* Expertise in JavaScript, TypeScript, and the JavaScript object model, with hands\\-on experience in developing scalable front\\-end applications using ReactJS.
* Proven experience in designing deployment and release strategies for enterprise\\-grade applications.
* Proficiency in unit and functional testing using tools such as Mocha, Jest, Jasmine, Selenium, or TestCafe, with experience in writing mocks and automated tests.
* 5\\.Deep understanding of web application architecture and performance, including browser compatibility, accessibility, UI testing, DNS, traffic management, and load balancing


**Your Role And Responsibilities**
* Strong Problem solving, coding skills, JavaScript/Typescript, GraphQL, OOJS, React.JS, design, architecture.
* Expert level JavaScript (ES6\\), HTML, CSS, nextJS and nodejs.
* Thorough understanding of React.js and its core principles


**Preferred Education**
 Master's Degree
   

  

**Required Technical And Professional Expertise**
 In this role, you'll work in one of our IBM Consulting Client Innovation Centers (Delivery Centers), where we deliver deep technical and industry expertise to a wide range of public and private sector clients around the world. Our delivery centers offer our clients locally based skills and technical expertise to drive innovation and adoption of new technology.
   

  

**Preferred Technical And Professional Experience**
* Experience integrating front\\-end applications with RESTful APIs, GraphQL, or other backend services.
* Familiarity with modern build and deployment tools such as Webpack, Babel, NPM, Git, and CI/CD pipelines.
* Knowledge of cloud platforms (AWS, Azure, or GCP) and containerization technologies like Docker for front\\-end application deployment","IT Services and IT Consulting","https://www.linkedin.com/company/ibm","https://media.licdn.com/dms/image/v2/D560BAQGiz5ecgpCtkA/company-logo_100_100/company-logo_100_100/0/1688684715866/ibm_logo?e=2147483647&v=beta&t=HPSmWLOCvdPkWO1nRWwjjmCNpaCqww20rSJ4E54QtxQ","","","","","","","","","","",""
"li-4342867556","linkedin","https://www.linkedin.com/jobs/view/4342867556","","Software Engineer","Hewlett Packard Enterprise","Bengaluru, Karnataka, India","","fulltime","","","","","",True,"not applicable","Engineering and Information Technology","","","This role has been designated as ‘Remote/Teleworker’, which means you will primarily work from home.
   

  

**Who We Are**
 Hewlett Packard Enterprise is the global edge\\-to\\-cloud company advancing the way people live and work. We help companies connect, protect, analyze, and act on their data and applications wherever they live, from edge to cloud, so they can turn insights into outcomes at the speed required to thrive in today’s complex world. Our culture thrives on finding new and better ways to accelerate what’s next. We know varied backgrounds are valued and succeed here. We have the flexibility to manage our work and personal needs. We make bold moves, together, and are a force for good. If you are looking to stretch and grow your career our culture will embrace you. Open up opportunities with HPE.
   

  

**Job Description**
***Job Family Definition:***
 Analyzes, designs, programs, debugs, and modifies software enhancements and/or new products used in local, networked, or Internet\\- related computer programs, primarily for end users. Using current programming language and technologies, writes code, completes programming, and performs testing and debugging of applications. Completes documentation and procedures for installation and maintenance. May interact with users to define system requirements and/or necessary modifications.
   

  

**Management Level Definition**
 Contributes to assignments of limited scope by applying technical concepts and theoretical knowledge acquired through specialized training, education, or previous experience. Acts as team member by providing information, analysis and recommendations in support of team efforts. Exercises independent judgment within defined parameters.
   

  

**Responsibilities**
* Codes and programs enhancements, updates, and changes for portions and subsystems of end\\- user applications software running on local, networked, and Internet\\- based platforms based on specific requirements and instructions.
* Executes established test plans and protocols for assigned portions of code; identifies, logs, and debugs assigned issues.
* Develops understanding of and relationship with internal and outsourced development partners on software applications design and development.
* Participates as a member of project team of other software applications engineers and internal and outsourced development partners to develop reliable, cost effective and high quality solutions for low to moderately\\- complex products.


**Education And Experience Required**
* Bachelor's or Master's degree in Computer Science, Information Systems, or equivalent.
* Typically 0\\-2 years experience.


**Knowledge And Skills**
* Experience or understanding of software applications design tools and languages.
* Good analytical and problem solving skills.
* Understanding of design for software applications running on multiple platform types.
* Understanding of basic testing, coding, and debugging procedures.
* Good written and verbal communication skills; mastery in English and local language.


**Additional Skills**
 Cross Domain Knowledge, Design Thinking, Development Fundamentals, Full Stack Development, Release Management, Security\\-First Mindset, User Experience (UX)
   

  

**What We Can Offer You**
**Health \\& Wellbeing**
 We strive to provide our team members and their loved ones with a comprehensive suite of benefits that supports their physical, financial and emotional wellbeing.
   

  

**Personal \\& Professional Development**
 We also invest in your career because the better you are, the better we all are. We have specific programs catered to helping you reach any career goals you have — whether you want to become a knowledge expert in your field or apply your skills to another division.
   

  

**Unconditional Inclusion**
 We are unconditionally inclusive in the way we work and celebrate individual uniqueness. We know varied backgrounds are valued and succeed here. We have the flexibility to manage our work and personal needs. We make bold moves, together, and are a force for good.
   

  

**Let's Stay Connected**
 Follow @HPECareers on Instagram to see the latest on people, culture and tech at HPE.
   

  

**Job**
 Engineering
   

  

**Job Level**
 TCP\\_01
   

  

 HPE is an Equal Employment Opportunity/ Veterans/Disabled/LGBT employer. We do not discriminate on the basis of race, gender, or any other protected category, and all decisions we make are made on the basis of qualifications, merit, and business need. Our goal is to be one global team that is representative of our customers, in an inclusive environment where we can continue to innovate and grow together. Please click here: Equal Employment Opportunity.
   

  

**Hewlett Packard Enterprise is EEO Protected Veteran/ Individual with Disabilities.**
 HPE will comply with all applicable laws related to employer use of arrest and conviction records, including laws requiring employers to consider for employment qualified applicants with criminal histories.
   

  

**No Fees Notice \\& Recruitment Fraud Disclaimer**
*It has come to HPE’s attention that there has been an increase in recruitment fraud whereby scammer impersonate HPE or HPE\\-authorized recruiting agencies and offer fake employment opportunities to candidates. These scammers often seek to obtain personal information or money from candidates.*
*Please note that Hewlett Packard Enterprise (HPE), its direct and indirect subsidiaries and affiliated companies, and its authorized recruitment agencies/vendors
 **will never charge any candidate a registration fee, hiring fee, or any other fee in connection with its recruitment and hiring process.** 
 The credentials of any hiring agency that claims to be working with HPE for recruitment of talent should be verified by candidates and candidates shall be solely responsible to conduct such verification. Any candidate/individual who relies on the erroneous representations made by fraudulent employment agencies does so at their own risk, and HPE disclaims liability for any damages or claims that may result from any such communication.*","IT Services and IT Consulting","https://www.linkedin.com/company/hewlett-packard-enterprise","https://media.licdn.com/dms/image/v2/D4E0BAQG3eeRIFGMG9g/company-logo_100_100/B4EZdkxlEZH0AU-/0/1749742408362/hewlett_packard_enterprise_logo?e=2147483647&v=beta&t=ijFn20TK1upEkeiP1oWhqe152s87m6307NkiugLc8_E","","","","","","","","","","",""
