"id","site","job_url","job_url_direct","title","company","location","date_posted","job_type","salary_source","interval","min_amount","max_amount","currency","is_remote","job_level","job_function","listing_type","emails","description","company_industry","company_url","company_logo","company_url_direct","company_addresses","company_num_employees","company_revenue","company_description","skills","experience_range","company_rating","company_reviews_count","vacancy_count","work_from_home_type"
"li-4428359093","linkedin","https://www.linkedin.com/jobs/view/4428359093","","Software Engineer","Wells Fargo","","","fulltime","","","","","",False,"associate","Information Technology and Engineering","","","**About This Role**
 Wells Fargo is seeking a Software Engineer
   

  

**In This Role, You Will**
* Participate in low to moderately complex initiatives and projects associated with the technology domain, including installation, upgrades, and deployment efforts
* Identify opportunities for service quality and availability improvements within the technology domain environment
* Design, code, test, debug, and document for low to moderately complex projects and programs associated with technology domain, including upgrades and deployments
* Review and analyze technical assignments or challenges that are related to low to medium risk deliverables and that require research, evaluation, and selection of alternative technology domains
* Present recommendations for resolving issues or may escalate issues as needed to meet established service level agreements
* Exercise some independent judgment while also developing understanding of given technology domain in reference to security and compliance requirements
* Provide information to technology colleagues, internal partners, and stakeholders


**Required Qualifications:**
* 2\\+ years of software engineering experience, or equivalent demonstrated through one or a combination of the following: work experience, training, military experience, education


**Desired Qualifications:**
* Knowledge in UX design tools
* Knowledge in CI/CD, Devops
* Knowledge in Cross Browser Validation tools and performance monitoring tools
* Software Engineer \\- Experience of handling larger teams working across one or more geographic territories or regions


**Job Expectations:**
* Mandatory Skills
* Core UI Development experience with expertise in MERN (MongoDB, Express Server, React, and Node) stack and hands on in JQuery, JavaScript, HTML and CSS.
* Hands on experience with Unit Testing (Jest, Enzyme \\& testing\\-library preferred)/ TDD \\- Scripting \\& Automated Testing using Web Driver IO, Continuous Integration \\& Deployment (CI/CD), Behavior Driven Development (BDD)
* Hands on experience developing functional based components and experience working in Hooks, Redux, Memo, HOC.
* Hands on experience developing Accessibility compliance applications
* Hands on experience in packaging and deploying UI deliverables
* Strong in OOAD, asynchronous programming, design and implementation of web applications, Design Patterns.
* Product \\& Design Knowledge \\- Experience with Product Development, Large Enterprise Scale Integrations (preferably in design/development of customer facing large enterprise applications)
* Experience in Digital Banking/ecommerce or any complex customer facing applications
* Excellent business communication skills
* Software Engineer \\- Experience with Enterprise Mobility Applications Performance Tuning, Scaling and Security Best Practices


**Posting End Date:**
 18 Jun 2026
   

  

* Job posting may come down early due to volume of applicants.


**We Value Equal Opportunity**
 Wells Fargo is an equal opportunity employer. All qualified applicants will receive consideration for employment without regard to race, color, religion, sex, sexual orientation, gender identity, national origin, disability, status as a protected veteran, or any other legally protected characteristic.
   

  

 Employees support our focus on building strong customer relationships balanced with a strong risk mitigating and compliance\\-driven culture which firmly establishes those disciplines as critical to the success of our customers and company. They are accountable for execution of all applicable risk programs (Credit, Market, Financial Crimes, Operational, Regulatory Compliance), which includes effectively following and adhering to applicable Wells Fargo policies and procedures, appropriately fulfilling risk and compliance obligations, timely and effective escalation and remediation of issues, and making sound risk decisions. There is emphasis on proactive monitoring, governance, risk identification and escalation, as well as making sound risk decisions commensurate with the business unit's risk appetite and all risk and compliance program requirements.
   

  

 Candidates applying to job openings posted in Canada: Applications for employment are encouraged from all qualified candidates, including women, persons with disabilities, aboriginal peoples and visible minorities. Accommodation for applicants with disabilities is available upon request in connection with the recruitment process.
   

  

**Applicants With Disabilities**
 To request a medical accommodation during the application or interview process, visit Disability Inclusion at Wells Fargo .
   

  

**Drug and Alcohol Policy**
 Wells Fargo maintains a drug free workplace. Please see our Drug and Alcohol Policy to learn more.
   

  

**Wells Fargo Recruitment And Hiring Requirements**
* Third\\-Party recordings are prohibited unless authorized by Wells Fargo.
* Wells Fargo requires you to directly represent your own experiences during the recruiting and hiring process.


**Reference Number**
 R\\-548424","Financial Services, Investment Management, and Banking","https://www.linkedin.com/company/wellsfargo","https://media.licdn.com/dms/image/v2/C4D0BAQGLxWPpGqaVmw/company-logo_100_100/company-logo_100_100/0/1630471638964/wellsfargo_logo?e=2147483647&v=beta&t=D1e-PmlhlUZN0ekIYF0M9XadtGDukrr58ywiHYGlJ_Y","","","","","","","","","","",""
"li-4398833648","linkedin","https://www.linkedin.com/jobs/view/4398833648","","(IND) SENIOR, SOFTWARE ENGINEER","Walmart Global Tech India","Bengaluru, Karnataka, India","","fulltime","","","","","",False,"mid-senior level","Engineering and Information Technology","","","Walmart's Enterprise Business Services (EBS) is a powerhouse of several exceptional teams delivering world\\-class technology solutions and services making a profound impact at every level of Walmart.
   

  

 As a key part of Walmart Global Tech, our teams set the bar for operational excellence and leverage emerging technology to support millions of customers, associates, and stakeholders worldwide. Each time an associate turns on their laptop, a customer makes a purchase, a new supplier is onboarded, the company closes the books, physical and legal risk is avoided, and when we pay our associates consistently and accurately, that is EBS. Joining EBS means embarking on a journey of limitless growth, relentless innovation, and the chance to set new industry standards that shape the future of Walmart.
   

  

 Team is looking for a strong Senior Software Engineer (Full stack) who will drive building next generation Walmart suite of products and platform by designing, coding, building and deploying highly scalable and robust cloud based solutions. The role is expected to make a difference to the products in terms of the design and contribute towards identifying technical risks and find alternate solutions to various problems. In addition to that, the role also demands to lead, motivate, mentor and provide ample guidance to the other team members with respect to technical challenges.
   

  

 As a part of Enterprise Business Services Bangalore team in India that works on building solutions various business functions for multiple Walmart markets, your design and solution will have a significant impact on day\\-to\\-day running of Walmart. You will be challenged with unparalleled complex business problems that spans across multiple countries, large number of users and data.
   

  

 What you will do
   

  

 You will work with the team and help them on technical aspects, set quality standards and participate in design discussion and drive technical decisions
   

  

 Architecture/Design Reviews within the team and across the teams
   

  

 Code Reviews across teams
   

  

 Engage with Product Management and Business to drive the agenda, set your priorities and deliver awesome products.
   

  

 Drive design, development, implementation and documentation
   

  

 Build, test and deploy cutting edge solutions at scale, impacting associates of Walmart worldwide.
   

  

 Interact with Walmart engineering teams across geographies to leverage expertise and contribute to the tech community.
   

  

 Drive the success of the implementation by applying technical skills, to design and build enhanced processes and technical solutions in support of strategic initiatives.
   

  

 You will use your engineering experience and technical skill to develop highly scalable and robust solutions. You will work with Engineering Lead/architect.
   

  

 Work closely with the Architects and cross functional teams and follow established practices for the delivery of solutions meeting QCD (Quality, Cost ; Delivery). Within the established architectural guidelines.
   

  

 Work with senior leadership to chart out the future roadmap of the products
   

  

 Participate in hiring and build teams enabling them to be high performing agile teams.
   

  

 Interact closely for requirements with Business owners and technical teams both within India and across the globe.
   

  

 What you'll bring:
   

  

 Bachelor’s / Master’s degree in computer science, Computer Engineering, or a related technical field required
   

  

 Excellent team player with a passion for collaboration and innovation
   

  

 7\\+ years of experience in application development using Python‑based REST APIs and Next.js, with containerized deployments on Kubernetes using Docker and microservices architecture, and strong experience with SQL and NoSQL databases
   

  

 Strong experience in designing, developing, and deploying scalable python\\-based applications and microservices
   

  

 Deep understanding of System Design principles and hands on experience with CI/CD and testing tools
   

  

 Proficiency with monitoring and observability tools such as, Prometheus, and Grafana
   

  

 Exposure to AI\\-assisted development tools like GitHub Copilot
   

  

 Expertise in cloud platforms preferably Google Cloud
   

  

 Experience with frontend integration using Next.js, React.js
   

  

 Basic Understanding of AIOps, Large Language Models (LLMs), Generative AI, and Agentic AI concepts
   

  

 Experience developing highly scalable and available enterprise\\-grade products
   

  

 Hands\\-on experience working in Agile development environments
   

  

 Strong knowledge of application security concepts (authentication, authorization, encryption, etc.) and enterprise security best practices
   

  

 Open to learning and adopting new technologies as per project requirements
   

  

**About Walmart Global Tech**
 Imagine working in an environment where one line of code can make life easier for hundreds of millions of people. Thats what we do at Walmart Global Tech. Were a team of software engineers, data scientists, cybersecurity experts and service professionals within the worlds leading retailer who make an epic impact and are at the forefront of the next retail disruption. People are why we innovate, and people power our innovations. We are people\\-led and tech\\-empowered.
   

  

 We train our team in the skillsets of the future and bring in experts like you to help us grow. We have roles for those chasing their first opportunity as well as those looking for the opportunity that will define their career. Here, you can kickstart a great career in tech, gain new skills and experience for virtually every industry, or leverage your expertise to innovate at scale, impact millions and reimagine the future of retail.
   

  

**Benefits**
 Beyond our great compensation package, you can receive incentive awards for your performance. Other great perks include a host of best\\-in\\-class benefits maternity and parental leave, PTO, health benefits, and much more.
   

  

 Walmart’s culture sets us apart, and we know being together helps us innovate, learn and grow great careers. This role is based in our \\[Bangalore/Chennai] office for daily work, with the flexibility for associates to manage their personal lives.
   

  

 Belonging
   

  

 We aim to create a culture where every associate feels valued for who they are, rooted in respect for the individual. Our goal is to foster a sense of belonging, to create opportunities for all our associates, customers and suppliers, and to be a Walmart for everyone.
   

  

 At Walmart, our vision is ""everyone included."" By fostering a workplace culture where everyone is and feels included, everyone wins. Our associates and customers reflect the makeup of all 19 countries where we operate. By making Walmart a welcoming place where all people feel like they belong, were able to engage associates, strengthen our business, improve our ability to serve customers, and support the communities where we operate.
   

  

 Equal Opportunity Employer:
   

  

 Walmart, Inc. is an Equal Opportunity Employer By Choice. We believe we are best equipped to help our associates, customers and the communities we serve live better when we really know them. That means understanding, respecting, and valuing unique styles, experiences, identities, ideas and opinions while being welcoming of all people.
   

  

 Minimum Qualifications...Outlined below are the required minimum qualifications for this position. If none are listed, there are no minimum qualifications.
   

  

 Option 1: Bachelor's degree in computer science, computer engineering, computer information systems, software engineering, or related area and 3 years’ experience in software engineering or related area.
   

  

 Option 2: 5 years’ experience in software engineering or related area.
   

  

 Preferred Qualifications...Outlined below are the optional preferred qualifications for this position. If none are listed, there are no preferred qualifications.
   

  

 Master’s degree in computer science, information technology, engineering, information systems, cybersecurity, or related area and 1 year’s experience leading information security or cybersecurity projects, We value candidates with a background in creating inclusive digital experiences, demonstrating knowledge in implementing Web Content Accessibility Guidelines (WCAG) 2\\.2 AA standards, assistive technologies, and integrating digital accessibility seamlessly. The ideal candidate would have knowledge of accessibility best practices and join us as we continue to create accessible products and services following Walmart’s accessibility standards and guidelines for supporting an inclusive culture.
   

  

 Information Technology \\- CISCO Certification \\- CertificationPrimary Location...Block\\- 1, Prestige Tech Pacific Park, Kadubeesanahalli Village, Varthur Hobli , India","Software Development","https://in.linkedin.com/company/walmartglobaltechindia","https://media.licdn.com/dms/image/v2/C4D0BAQEC3n4yU_w6bQ/company-logo_100_100/company-logo_100_100/0/1630541053165/walmartglobaltechindia_logo?e=2147483647&v=beta&t=KB5uAZVI1HRhFi7_oz2n8i2VD4Sx9DcqRNE-fpD1_zY","","","","","","","","","","",""
"li-4384791627","linkedin","https://www.linkedin.com/jobs/view/4384791627","","SENIOR, SOFTWARE ENGINEER","Walmart Global Tech India","Bengaluru, Karnataka, India","","fulltime","","","","","",False,"mid-senior level","Engineering and Information Technology","","","Job Description Summary:
   

  

 Responsible for coding, unit testing, building high performance and scalable applications that meet the needs of millions of Walmart\\-International customers, in the areas of supply chain management \\& Customer experience.
   

  

 About Team:
   

  

 Our team collaborates with Walmart International, which has over 5,900 retail units operating outside of the United States under 55 banners in 26 countries including Africa, Argentina, Canada, Central America, Chile, China, India, Japan, and Mexico, to name a few.
   

  

 We are seeking a highly skilled Senior Software Engineer with knowledge in TRIRIGA to design, develop, and deploy features for Real Estate team. The ideal candidate will leverage their extensive experience to create seamless user experiences, collaborate with cross\\-functional teams, and mentor junior engineers.
   

  

 What you'll do:
   

  

 You are responsible for coding, unit testing, building high performance and scalable applications that meet the needs of millions of Walmart\\-International customers, in the areas of supply chain management \\& Customer experience.
   

  

 You are expected to be more intellectually curious engineer who is passionate about domain/technology in general.
   

  

 What you'll bring:
   

  

 Design and development of innovative solutions in TRIRIGA.
   

  

 Translate complex user requirements into intuitive, user\\-friendly interfaces.
   

  

 Collaborate with product managers, developers, and stakeholders to define project requirements and deliverables.
   

  

 Ensure consistency in coding standards across all products and platforms.
   

  

 Deep knowledge in Tririga builder tools and Platform.
   

  

 Ability to integrate Tririga with other ERP application by using Java and Tririga Tools.
   

  

 Strong functional knowledge in one or more of following modules Lease management, Capital Projects and Facility management
   

  

 Mentor and provide guidance to junior team members.
   

  

 Identidy and address Performance bottlenecks for better implementation of solutions within Tririga.
   

  

 Ensure strategic use of prototypes to test, validate, and evolve user experiences.
   

  

 Champion high\\-quality design outcomes that connect business value with user\\-centered practices.
   

  

 Lead narrative design and storytelling to articulate impact across functions and levels of the organization.
   

  

 Proactively identify gaps in partner or stakeholder understanding, and collaboratively use design and research to address them.
   

  

 Clearly communicate design intent, tradeoffs, and user value to non\\-design audiences.
   

  

 Influence product roadmaps and user outcomes through well\\-grounded design in Tririga
   

  

 Lead initiatives to advance Tririga maturity, measure and communicate success, and evolve design practices at scale
   

  

**About Walmart Global Tech**
 Imagine working in an environment where one line of code can make life easier for hundreds of millions of people. That’s what we do at Walmart Global Tech. We’re a team of software engineers, data scientists, cybersecurity expert's and service professionals within the world’s leading retailer who make an epic impact and are at the forefront of the next retail disruption. People are why we innovate, and people power our innovations. We are people\\-led and tech\\-empowered.
   

  

 We train our team in the skillsets of the future and bring in experts like you to help us grow. We have roles for those chasing their first opportunity as well as those looking for the opportunity that will define their career. Here, you can kickstart a great career in tech, gain new skills and experience for virtually every industry, or leverage your expertise to innovate at scale, impact millions and reimagine the future of retail.
   

  

 Work
   

  

 Walmart’s culture sets us apart, and we know being together helps us innovate, learn and grow great careers. This role is based in our Bangalore office for daily work, with the flexibility for associates to manage their personal lives
   

  

**Benefits**
 Beyond our great compensation package, you can receive incentive awards for your performance. Other great perks include a host of best\\-in\\-class benefits maternity and parental leave, PTO, health benefits, and much more.
   

  

 Belonging
   

  

 We aim to create a culture where every associate feels valued for who they are, rooted in respect for the individual. Our goal is to foster a sense of belonging, to create opportunities for all our associates, customers and suppliers, and to be a Walmart for everyone.
   

  

 At Walmart, our vision is ""everyone included."" By fostering a workplace culture where everyone is—and feels—included, everyone wins. Our associates and customers reflect the makeup of all 19 countries where we operate. By making Walmart a welcoming place where all people feel like they belong, we’re able to engage associates, strengthen our business, improve our ability to serve customers, and support the communities where we operate.
   

  

 Equal Opportunity Employer
   

  

 Walmart, Inc., is an Equal Opportunities Employer – By Choice. We believe we are best equipped to help our associates, customers and the communities we serve live better when we really know them. That means understanding, respecting and valuing unique styles, experiences, identities, ideas and opinions – while being inclusive of all people.
   

  

 Minimum Qualifications...Outlined below are the required minimum qualifications for this position. If none are listed, there are no minimum qualifications.
   

  

 Option 1: Bachelor's degree in computer science, computer engineering, computer information systems, software engineering, or related area and 3 years’ experience in software engineering or related area.
   

  

 Option 2: 5 years’ experience in software engineering or related area.
   

  

 Preferred Qualifications...Outlined below are the optional preferred qualifications for this position. If none are listed, there are no preferred qualifications.
   

  

 Master’s degree in computer science, information technology, engineering, information systems, cybersecurity, or related area and 1 year’s experience leading information security or cybersecurity projects, We value candidates with a background in creating inclusive digital experiences, demonstrating knowledge in implementing Web Content Accessibility Guidelines (WCAG) 2\\.2 AA standards, assistive technologies, and integrating digital accessibility seamlessly. The ideal candidate would have knowledge of accessibility best practices and join us as we continue to create accessible products and services following Walmart’s accessibility standards and guidelines for supporting an inclusive culture.
   

  

 Information Technology \\- CISCO Certification \\- CertificationPrimary Location...BLOCK\\- 2, PRESTIGE TECH PACIFIC PARK, SY NO. 38/1P, OUTER RING ROAD KADUBEESANAHALLI, , India","Software Development","https://in.linkedin.com/company/walmartglobaltechindia","https://media.licdn.com/dms/image/v2/C4D0BAQEC3n4yU_w6bQ/company-logo_100_100/company-logo_100_100/0/1630541053165/walmartglobaltechindia_logo?e=2147483647&v=beta&t=KB5uAZVI1HRhFi7_oz2n8i2VD4Sx9DcqRNE-fpD1_zY","","","","","","","","","","",""
